model	mse_within	mse_cross	mae_within	mae_cross	cls_acc_within	cls_acc_cross	cls_trans_within	cls_trans_cross	majority_acc_within	majority_acc_cross	unc_sep_within	unc_sep_cross	cls_acc_cdf_within	cls_acc_cdf_cross	cls_trans_cdf_within	cls_trans_cdf_cross	n_within	n_cross	config	status	description
LSTM	0.012831	0.020510	0.084677	0.114937	0.955777	0.836400	0.532787	0.499371	0.805320	0.826750							6128	4456	{"cfg": "PLAIN 4CAM", "mode": "lstm", "n_features": 65, "hidden_size": 256, "n_layers": 4, "dropout": 0.4, "lr": 0.001, "batch_size": 64, "sub_window": 6, "n_steps": 5, "warmup_frames": 400, "t1_percentile": 25, "t2_percentile": 90, "t1": 0.3194, "t2": 0.8611, "train_stride": 6}	baseline	[BASELINE PLAIN 4CAM]
LSTM	0.015484	0.019815	0.094262	0.110892	0.951044	0.854129	0.573770	0.445283	0.805320	0.826750							6128	4456	{"cfg": "PLAIN 4CAM", "mode": "lstm", "n_features": 65, "hidden_size": 256, "n_layers": 4, "dropout": 0.4, "lr": 0.001, "batch_size": 64, "sub_window": 6, "n_steps": 5, "warmup_frames": 400, "t1_percentile": 25, "t2_percentile": 90, "t1": 0.3194, "t2": 0.8611, "train_stride": 6, "transition_loss_weight": 1}	discarded	[TW PLAIN 4CAM w=1] mse +20.7% > 10% threshold
LSTM	0.015317	0.018582	0.096315	0.109070	0.956756	0.828995	0.540984	0.520755	0.805320	0.826750							6128	4456	{"cfg": "PLAIN 4CAM", "mode": "lstm", "n_features": 65, "hidden_size": 256, "n_layers": 4, "dropout": 0.4, "lr": 0.001, "batch_size": 64, "sub_window": 6, "n_steps": 5, "warmup_frames": 400, "t1_percentile": 25, "t2_percentile": 90, "t1": 0.3194, "t2": 0.8611, "train_stride": 6, "transition_loss_weight": 2}	discarded	[TW PLAIN 4CAM w=2] mse +19.4% > 10% threshold
LSTM	0.014811	0.020015	0.094537	0.113121	0.954634	0.826750	0.535519	0.503145	0.805320	0.826750							6128	4456	{"cfg": "PLAIN 4CAM", "mode": "lstm", "n_features": 65, "hidden_size": 256, "n_layers": 4, "dropout": 0.4, "lr": 0.001, "batch_size": 64, "sub_window": 6, "n_steps": 5, "warmup_frames": 400, "t1_percentile": 25, "t2_percentile": 90, "t1": 0.3194, "t2": 0.8611, "train_stride": 6, "transition_loss_weight": 3}	discarded	[TW PLAIN 4CAM w=3] mse +15.4% > 10% threshold
EvidentialLSTM	0.014057	0.019752	0.089898	0.113254	0.957082	0.826526	0.584699	0.500629	0.805320	0.826750	0.107481	0.091502	0.957735	0.826077	0.584699	0.503145	6128	4456	{"mode": "evidential", "model": "EvidentialLSTM", "n_features": 65, "window": 30, "horizon": 30, "sub_window": 6, "n_steps": 5, "hidden_size": 128, "n_layers": 4, "dropout": 0.4, "lr": 0.001, "batch_size": 64, "t1_percentile": 25, "t2_percentile": 90, "t1": 0.3194, "t2": 0.8611, "lambda1": 0.25, "transition_loss_weight": 3}	kept	[TW EVID 4CAM MSE w=3] cls_trans 0.503->0.585\! mse 5.3% worse, unc_sep ok
EvidentialLSTM	0.015118	0.019235	0.090914	0.108278	0.959856	0.857944	0.551913	0.465409	0.805320	0.826750	0.099983	0.075189	0.960672	0.856373	0.551913	0.461635	6128	4456	{"transition_loss_weight": 2, "lambda1": 0.25}	discarded	[TW EVID 4CAM MSE w=2] cls_trans up but mse 13% worse
LSTM	0.014498	0.022633	0.093375	0.120693	0.957735	0.826077	0.565574	0.500629	0.805320	0.826750							6128	4456	{"cfg": "PLAIN 4CAM", "mode": "lstm", "n_features": 65, "hidden_size": 256, "n_layers": 4, "dropout": 0.4, "lr": 0.001, "batch_size": 64, "sub_window": 6, "n_steps": 5, "warmup_frames": 400, "t1_percentile": 25, "t2_percentile": 90, "t1": 0.3194, "t2": 0.8611, "train_stride": 6, "transition_loss_weight": 5}	discarded	[TW PLAIN 4CAM w=5] mse +13.0% > 10% threshold
LSTM	0.018380	0.023622	0.107729	0.124289	0.953166	0.826750	0.560109	0.500629	0.805320	0.826750							6128	4456	{"cfg": "PLAIN 4CAM", "mode": "lstm", "n_features": 65, "hidden_size": 256, "n_layers": 4, "dropout": 0.4, "lr": 0.001, "batch_size": 64, "sub_window": 6, "n_steps": 5, "warmup_frames": 400, "t1_percentile": 25, "t2_percentile": 90, "t1": 0.3194, "t2": 0.8611, "train_stride": 6, "transition_loss_weight": 8}	discarded	[TW PLAIN 4CAM w=8] mse +43.2% > 10% threshold
LSTM	0.017006	0.025611	0.101827	0.125818	0.951860	0.810592	0.625683	0.605031	0.805320	0.826750							6128	4456	{"cfg": "PLAIN 4CAM", "mode": "lstm", "n_features": 65, "hidden_size": 256, "n_layers": 4, "dropout": 0.4, "lr": 0.001, "batch_size": 64, "sub_window": 6, "n_steps": 5, "warmup_frames": 400, "t1_percentile": 25, "t2_percentile": 90, "t1": 0.3194, "t2": 0.8611, "train_stride": 6, "transition_loss_weight": 10}	discarded	[TW PLAIN 4CAM w=10] mse +32.5% > 10% threshold
EvidentialLSTM	0.016903	0.022773	0.097802	0.120149	0.950392	0.813285	0.612022	0.545912	0.805320	0.826750	0.085093	0.077581	0.950881	0.809022	0.606557	0.552201	6128	4456	{"transition_loss_weight": 5, "lambda1": 0.25}	discarded	[TW EVID 4CAM MSE w=5] cls_trans 0.612 but mse 27% worse
LSTM	0.014627	0.033899	0.092307	0.139909	0.954308	0.752469	0.546448	0.488050	0.805320	0.826750							6128	4456	{"cfg": "PLAIN 4CAM", "mode": "lstm", "n_features": 81, "hidden_size": 256, "n_layers": 4, "dropout": 0.4, "lr": 0.001, "batch_size": 64, "sub_window": 6, "n_steps": 5, "warmup_frames": 400, "t1_percentile": 25, "t2_percentile": 90, "t1": 0.3194, "t2": 0.8611, "train_stride": 6, "use_delta_features": true}	discarded	[DELTA PLAIN 4CAM] mse +14.0% > 10% threshold
EvidentialLSTM	0.014188	0.026531	0.090379	0.129981	0.937909	0.945863	0.512702	0.500000	0.850599	0.945863	0.185381	0.072057	0.937909	0.945863	0.510393	0.500000	6265	4544	{"mode": "evidential", "model": "EvidentialLSTM", "n_features": 65, "window": 30, "horizon": 30, "sub_window": 6, "n_steps": 5, "hidden_size": 128, "n_layers": 4, "dropout": 0.4, "lr": 0.001, "batch_size": 64, "t1_percentile": 20, "t2_percentile": 90, "t1": 0.1944, "t2": 0.8611, "lambda1": 0.28}	kept	[EVID 4CAM UNC baseline] cls_trans=0.513, unc_sep=0.185
LSTM	0.013804	0.022122	0.088679	0.119152	1.000000	0.999776	0.000000	0.500000	1.000000	0.999776							6128	4456	{"cfg": "PLAIN 4CAM", "mode": "lstm", "n_features": 65, "hidden_size": 256, "n_layers": 4, "dropout": 0.4, "lr": 0.001, "batch_size": 64, "sub_window": 1, "n_steps": 30, "warmup_frames": 400, "t1_percentile": 25, "t2_percentile": 90, "t1": 0.0, "t2": 1.0, "train_stride": 6}	discarded	[SW1 PLAIN 4CAM] cls_trans 0.0000 <= baseline 0.5328
LSTM	0.015935	0.017805	0.096835	0.105754	0.947454	0.955790	0.492347	0.500000	0.855907	0.955790							6128	4456	{"cfg": "PLAIN 4CAM", "mode": "lstm", "n_features": 65, "hidden_size": 256, "n_layers": 4, "dropout": 0.4, "lr": 0.001, "batch_size": 64, "sub_window": 2, "n_steps": 15, "warmup_frames": 400, "t1_percentile": 25, "t2_percentile": 90, "t1": 0.2, "t2": 1.0, "train_stride": 6}	discarded	[SW2 PLAIN 4CAM] cls_trans 0.4923 <= baseline 0.5328
LSTM	0.007972	0.007972	0.070105	0.070105	0.633125	0.633125	0.504016	0.504016	0.574386	0.574386							2077	2077	{"cfg": "PLAIN 1CAM", "mode": "lstm", "n_features": 35, "hidden_size": 96, "n_layers": 4, "dropout": 0.3, "lr": 0.003, "batch_size": 64, "sub_window": 6, "n_steps": 5, "warmup_frames": 300, "t1_percentile": 10, "t2_percentile": 70, "t1": 0.1389, "t2": 0.5667, "train_stride": 6, "single_cam": "Bellevue_Bellevue_NE8th"}	baseline	[BASELINE PLAIN 1CAM]
EvidentialLSTM	0.015220	0.025191	0.089712	0.123088	0.932961	0.941021	0.570439	0.522727	0.850599	0.945863	0.162256	0.126465	0.935355	0.929357	0.572748	0.527778	6265	4544	{"mode": "evidential", "model": "EvidentialLSTM", "n_features": 65, "window": 30, "horizon": 30, "sub_window": 6, "n_steps": 5, "hidden_size": 128, "n_layers": 4, "dropout": 0.4, "lr": 0.001, "batch_size": 64, "t1_percentile": 20, "t2_percentile": 90, "t1": 0.1944, "t2": 0.8611, "lambda1": 0.28, "transition_loss_weight": 3}	kept	[TW EVID 4CAM UNC w=3] cls_trans 0.513->0.570\! mse 7.3% worse, unc_sep 0.162
LSTM	0.007972	0.007972	0.070105	0.070105	0.633125	0.633125	0.504016	0.504016	0.574386	0.574386							2077	2077	{"cfg": "PLAIN 1CAM", "mode": "lstm", "n_features": 35, "hidden_size": 96, "n_layers": 4, "dropout": 0.3, "lr": 0.003, "batch_size": 64, "sub_window": 6, "n_steps": 5, "warmup_frames": 300, "t1_percentile": 10, "t2_percentile": 70, "t1": 0.1389, "t2": 0.5667, "train_stride": 6, "transition_loss_weight": 1, "single_cam": "Bellevue_Bellevue_NE8th"}	discarded	[TW PLAIN 1CAM w=1] cls_trans 0.5040 <= baseline 0.5040
LSTM	0.009775	0.009775	0.077395	0.077395	0.636495	0.636495	0.506024	0.506024	0.574386	0.574386							2077	2077	{"cfg": "PLAIN 1CAM", "mode": "lstm", "n_features": 35, "hidden_size": 96, "n_layers": 4, "dropout": 0.3, "lr": 0.003, "batch_size": 64, "sub_window": 6, "n_steps": 5, "warmup_frames": 300, "t1_percentile": 10, "t2_percentile": 70, "t1": 0.1389, "t2": 0.5667, "train_stride": 6, "transition_loss_weight": 2, "single_cam": "Bellevue_Bellevue_NE8th"}	discarded	[TW PLAIN 1CAM w=2] mse +22.6% > 10% threshold
LSTM	0.012756	0.012756	0.085277	0.085277	0.636013	0.636013	0.552209	0.552209	0.574386	0.574386							2077	2077	{"cfg": "PLAIN 1CAM", "mode": "lstm", "n_features": 35, "hidden_size": 96, "n_layers": 4, "dropout": 0.3, "lr": 0.003, "batch_size": 64, "sub_window": 6, "n_steps": 5, "warmup_frames": 300, "t1_percentile": 10, "t2_percentile": 70, "t1": 0.1389, "t2": 0.5667, "train_stride": 6, "transition_loss_weight": 3, "single_cam": "Bellevue_Bellevue_NE8th"}	discarded	[TW PLAIN 1CAM w=3] mse +60.0% > 10% threshold
LSTM	0.008893	0.008893	0.073060	0.073060	0.626866	0.626866	0.524096	0.524096	0.574386	0.574386							2077	2077	{"cfg": "PLAIN 1CAM", "mode": "lstm", "n_features": 35, "hidden_size": 96, "n_layers": 4, "dropout": 0.3, "lr": 0.003, "batch_size": 64, "sub_window": 6, "n_steps": 5, "warmup_frames": 300, "t1_percentile": 10, "t2_percentile": 70, "t1": 0.1389, "t2": 0.5667, "train_stride": 6, "transition_loss_weight": 5, "single_cam": "Bellevue_Bellevue_NE8th"}	discarded	[TW PLAIN 1CAM w=5] mse +11.6% > 10% threshold
EvidentialLSTM	0.013109	0.013109	0.092857	0.092857	0.425614	0.425614	0.497992	0.497992	0.574386	0.574386	-0.002467	-0.002467	0.425614	0.425614	0.497992	0.497992	2077	2077	{"transition_loss_weight": 3, "lambda1": 0.25, "single_cam": "NE8th"}	discarded	[TW EVID 1CAM w=3] destroyed model: mse 56% worse, unc_sep<0
LSTM	0.014563	0.014563	0.092511	0.092511	0.425614	0.425614	0.497992	0.497992	0.574386	0.574386							2077	2077	{"cfg": "PLAIN 1CAM", "mode": "lstm", "n_features": 35, "hidden_size": 96, "n_layers": 4, "dropout": 0.3, "lr": 0.003, "batch_size": 64, "sub_window": 6, "n_steps": 5, "warmup_frames": 300, "t1_percentile": 10, "t2_percentile": 70, "t1": 0.1389, "t2": 0.5667, "train_stride": 6, "transition_loss_weight": 8, "single_cam": "Bellevue_Bellevue_NE8th"}	discarded	[TW PLAIN 1CAM w=8] cls_trans 0.4980 <= baseline 0.5040
LSTM	0.010849	0.010849	0.080122	0.080122	0.425614	0.425614	0.497992	0.497992	0.574386	0.574386							2077	2077	{"cfg": "PLAIN 1CAM", "mode": "lstm", "n_features": 35, "hidden_size": 96, "n_layers": 4, "dropout": 0.3, "lr": 0.003, "batch_size": 64, "sub_window": 6, "n_steps": 5, "warmup_frames": 300, "t1_percentile": 10, "t2_percentile": 70, "t1": 0.1389, "t2": 0.5667, "train_stride": 6, "transition_loss_weight": 10, "single_cam": "Bellevue_Bellevue_NE8th"}	discarded	[TW PLAIN 1CAM w=10] cls_trans 0.4980 <= baseline 0.5040
LSTM	0.010014	0.010014	0.078524	0.078524	0.594608	0.594608	0.512048	0.512048	0.574386	0.574386							2077	2077	{"cfg": "PLAIN 1CAM", "mode": "lstm", "n_features": 51, "hidden_size": 96, "n_layers": 4, "dropout": 0.3, "lr": 0.003, "batch_size": 64, "sub_window": 6, "n_steps": 5, "warmup_frames": 300, "t1_percentile": 10, "t2_percentile": 70, "t1": 0.1389, "t2": 0.5667, "train_stride": 6, "use_delta_features": true, "single_cam": "Bellevue_Bellevue_NE8th"}	discarded	[DELTA PLAIN 1CAM] mse +25.6% > 10% threshold
LSTM	0.011068	0.011068	0.084178	0.084178	0.641310	0.641310	0.498973	0.498973	0.641310	0.641310							2077	2077	{"cfg": "PLAIN 1CAM", "mode": "lstm", "n_features": 35, "hidden_size": 96, "n_layers": 4, "dropout": 0.3, "lr": 0.003, "batch_size": 64, "sub_window": 1, "n_steps": 30, "warmup_frames": 300, "t1_percentile": 10, "t2_percentile": 70, "t1": 0.0, "t2": 0.6154, "train_stride": 6, "single_cam": "Bellevue_Bellevue_NE8th"}	discarded	[SW1 PLAIN 1CAM] cls_trans 0.4990 <= baseline 0.5040
LSTM	0.010151	0.010151	0.078919	0.078919	0.615311	0.615311	0.529750	0.529750	0.508907	0.508907							2077	2077	{"cfg": "PLAIN 1CAM", "mode": "lstm", "n_features": 35, "hidden_size": 96, "n_layers": 4, "dropout": 0.3, "lr": 0.003, "batch_size": 64, "sub_window": 2, "n_steps": 15, "warmup_frames": 300, "t1_percentile": 10, "t2_percentile": 70, "t1": 0.0, "t2": 0.5804, "train_stride": 6, "single_cam": "Bellevue_Bellevue_NE8th"}	discarded	[SW2 PLAIN 1CAM] mse +27.3% > 10% threshold
EvidentialLSTM	0.015151	0.021310	0.090478	0.116207	0.957245	0.855925	0.573770	0.428931	0.805320	0.826750	0.160656	0.132137	0.957082	0.847397	0.576503	0.441509	6128	4456	{"cfg": "EVID 4CAM MSE", "mode": "evidential", "n_features": 65, "hidden_size": 128, "n_layers": 4, "dropout": 0.4, "lr": 0.003, "batch_size": 64, "sub_window": 6, "n_steps": 5, "warmup_frames": 400, "t1_percentile": 25, "t2_percentile": 90, "t1": 0.3194, "t2": 0.8611, "train_stride": 6, "lambda1": 0.25}	baseline	[BASELINE EVID 4CAM MSE]
EvidentialLSTM	0.017023	0.021468	0.095103	0.116329	0.957409	0.864004	0.519126	0.445283	0.805320	0.826750	0.135532	0.079600	0.957082	0.861311	0.519126	0.454088	6128	4456	{"cfg": "EVID 4CAM MSE", "mode": "evidential", "n_features": 65, "hidden_size": 128, "n_layers": 4, "dropout": 0.4, "lr": 0.003, "batch_size": 64, "sub_window": 6, "n_steps": 5, "warmup_frames": 400, "t1_percentile": 25, "t2_percentile": 90, "t1": 0.3194, "t2": 0.8611, "train_stride": 6, "lambda1": 0.25, "transition_loss_weight": 1}	discarded	[TW EVID 4CAM MSE w=1] cls_trans 0.5191 <= baseline 0.5738
EvidentialLSTM	0.017340	0.022008	0.097666	0.119221	0.956756	0.826750	0.562842	0.500629	0.805320	0.826750	0.132924	0.081121	0.957898	0.826750	0.560109	0.500629	6128	4456	{"cfg": "EVID 4CAM MSE", "mode": "evidential", "n_features": 65, "hidden_size": 128, "n_layers": 4, "dropout": 0.4, "lr": 0.003, "batch_size": 64, "sub_window": 6, "n_steps": 5, "warmup_frames": 400, "t1_percentile": 25, "t2_percentile": 90, "t1": 0.3194, "t2": 0.8611, "train_stride": 6, "lambda1": 0.25, "transition_loss_weight": 2}	discarded	[TW EVID 4CAM MSE w=2] cls_trans 0.5628 <= baseline 0.5738
EvidentialLSTM	0.017992	0.028279	0.103011	0.129297	0.953492	0.799820	0.606557	0.496855	0.805320	0.826750	0.122550	0.117205	0.953982	0.791293	0.603825	0.496855	6128	4456	{"cfg": "EVID 4CAM MSE", "mode": "evidential", "n_features": 65, "hidden_size": 128, "n_layers": 4, "dropout": 0.4, "lr": 0.003, "batch_size": 64, "sub_window": 6, "n_steps": 5, "warmup_frames": 400, "t1_percentile": 25, "t2_percentile": 90, "t1": 0.3194, "t2": 0.8611, "train_stride": 6, "lambda1": 0.25, "transition_loss_weight": 3}	discarded	[TW EVID 4CAM MSE w=3] mse +18.7% > 10% threshold
EvidentialLSTM	0.017506	0.031312	0.098610	0.141284	0.955450	0.826302	0.628415	0.500629	0.805320	0.826750	0.095558	0.048010	0.955450	0.826302	0.614754	0.500629	6128	4456	{"cfg": "EVID 4CAM MSE", "mode": "evidential", "n_features": 65, "hidden_size": 128, "n_layers": 4, "dropout": 0.4, "lr": 0.003, "batch_size": 64, "sub_window": 6, "n_steps": 5, "warmup_frames": 400, "t1_percentile": 25, "t2_percentile": 90, "t1": 0.3194, "t2": 0.8611, "train_stride": 6, "lambda1": 0.25, "transition_loss_weight": 5}	discarded	[TW EVID 4CAM MSE w=5] mse +15.5% > 10% threshold
EvidentialLSTM	0.016569	0.031823	0.093768	0.141085	0.957409	0.803636	0.614754	0.533333	0.805320	0.826750	0.099955	0.066799	0.957898	0.796679	0.612022	0.538365	6128	4456	{"cfg": "EVID 4CAM MSE", "mode": "evidential", "n_features": 65, "hidden_size": 128, "n_layers": 4, "dropout": 0.4, "lr": 0.003, "batch_size": 64, "sub_window": 6, "n_steps": 5, "warmup_frames": 400, "t1_percentile": 25, "t2_percentile": 90, "t1": 0.3194, "t2": 0.8611, "train_stride": 6, "lambda1": 0.25, "transition_loss_weight": 8}	kept	[TW EVID 4CAM MSE w=8] cls_trans 0.5738->0.6148, mse +9.4%
EvidentialLSTM	0.016320	0.022796	0.095589	0.118286	0.950555	0.830341	0.650273	0.534591	0.805320	0.826750	0.089339	0.066308	0.951371	0.838869	0.633880	0.513208	6128	4456	{"cfg": "EVID 4CAM MSE", "mode": "evidential", "n_features": 65, "hidden_size": 128, "n_layers": 4, "dropout": 0.4, "lr": 0.003, "batch_size": 64, "sub_window": 6, "n_steps": 5, "warmup_frames": 400, "t1_percentile": 25, "t2_percentile": 90, "t1": 0.3194, "t2": 0.8611, "train_stride": 6, "lambda1": 0.25, "transition_loss_weight": 10}	kept	[TW EVID 4CAM MSE w=10] cls_trans 0.5738->0.6503, mse +7.7%
EvidentialLSTM	0.016892	0.020657	0.097109	0.112926	0.960672	0.859740	0.524590	0.433962	0.805320	0.826750	0.130058	0.084327	0.960999	0.859066	0.521858	0.431447	6128	4456	{"cfg": "EVID 4CAM MSE", "mode": "evidential", "n_features": 81, "hidden_size": 128, "n_layers": 4, "dropout": 0.4, "lr": 0.003, "batch_size": 64, "sub_window": 6, "n_steps": 5, "warmup_frames": 400, "t1_percentile": 25, "t2_percentile": 90, "t1": 0.3194, "t2": 0.8611, "train_stride": 6, "lambda1": 0.25, "use_delta_features": true}	discarded	[DELTA EVID 4CAM MSE] cls_trans 0.5246 <= baseline 0.5738
EvidentialLSTM	0.020309	0.033379	0.104050	0.146200	0.818701	0.999776	0.000000	0.500000	1.000000	0.999776	-0.096282	0.563511	0.818538	0.999776	0.000000	0.500000	6128	4456	{"cfg": "EVID 4CAM MSE", "mode": "evidential", "n_features": 65, "hidden_size": 128, "n_layers": 4, "dropout": 0.4, "lr": 0.003, "batch_size": 64, "sub_window": 1, "n_steps": 30, "warmup_frames": 400, "t1_percentile": 25, "t2_percentile": 90, "t1": 0.0, "t2": 1.0, "train_stride": 6, "lambda1": 0.25}	discarded	[SW1 EVID 4CAM MSE] cls_trans 0.0000 <= baseline 0.5738
EvidentialLSTM	0.017519	0.021555	0.096836	0.116616	0.941253	0.938285	0.512755	0.515924	0.855907	0.955790	0.348139	0.583033	0.939948	0.930880	0.507653	0.506369	6128	4456	{"cfg": "EVID 4CAM MSE", "mode": "evidential", "n_features": 65, "hidden_size": 128, "n_layers": 4, "dropout": 0.4, "lr": 0.003, "batch_size": 64, "sub_window": 2, "n_steps": 15, "warmup_frames": 400, "t1_percentile": 25, "t2_percentile": 90, "t1": 0.2, "t2": 1.0, "train_stride": 6, "lambda1": 0.25}	discarded	[SW2 EVID 4CAM MSE] cls_trans 0.5128 <= baseline 0.5738
EvidentialLSTM	0.018351	0.038510	0.098995	0.150047	0.920366	0.736086	0.590164	0.577358	0.805320	0.826750	0.039398	0.073441	0.919060	0.741248	0.592896	0.571069	6128	4456	{"cfg": "EVID 4CAM MSE", "mode": "evidential", "n_features": 81, "hidden_size": 128, "n_layers": 4, "dropout": 0.4, "lr": 0.003, "batch_size": 64, "sub_window": 6, "n_steps": 5, "warmup_frames": 400, "t1_percentile": 25, "t2_percentile": 90, "t1": 0.3194, "t2": 0.8611, "train_stride": 6, "lambda1": 0.25, "transition_loss_weight": 10, "use_delta_features": true}	discarded	[COMBO TW+DELTA(try) EVID 4CAM MSE] mse +21.1% > 10% threshold
EvidentialLSTM	0.015957	0.026339	0.094790	0.130045	0.938388	0.945863	0.501155	0.500000	0.850599	0.945863	0.260547	0.062078	0.938069	0.945863	0.496536	0.500000	6265	4544	{"cfg": "EVID 4CAM UNC", "mode": "evidential", "n_features": 65, "hidden_size": 128, "n_layers": 4, "dropout": 0.4, "lr": 0.003, "batch_size": 64, "sub_window": 6, "n_steps": 5, "warmup_frames": 300, "t1_percentile": 20, "t2_percentile": 90, "t1": 0.1944, "t2": 0.8611, "train_stride": 6, "lambda1": 0.28}	baseline	[BASELINE EVID 4CAM UNC]
EvidentialLSTM	0.015957	0.026339	0.094790	0.130045	0.938388	0.945863	0.501155	0.500000	0.850599	0.945863	0.260547	0.062078	0.938069	0.945863	0.496536	0.500000	6265	4544	{"cfg": "EVID 4CAM UNC", "mode": "evidential", "n_features": 65, "hidden_size": 128, "n_layers": 4, "dropout": 0.4, "lr": 0.003, "batch_size": 64, "sub_window": 6, "n_steps": 5, "warmup_frames": 300, "t1_percentile": 20, "t2_percentile": 90, "t1": 0.1944, "t2": 0.8611, "train_stride": 6, "lambda1": 0.28, "transition_loss_weight": 1}	discarded	[TW EVID 4CAM UNC w=1] cls_trans 0.5012 <= baseline 0.5012
EvidentialLSTM	0.015579	0.021260	0.092862	0.116812	0.939026	0.945863	0.540416	0.500000	0.850599	0.945863	0.251884	0.084060	0.939026	0.945863	0.542725	0.500000	6265	4544	{"cfg": "EVID 4CAM UNC", "mode": "evidential", "n_features": 65, "hidden_size": 128, "n_layers": 4, "dropout": 0.4, "lr": 0.003, "batch_size": 64, "sub_window": 6, "n_steps": 5, "warmup_frames": 300, "t1_percentile": 20, "t2_percentile": 90, "t1": 0.1944, "t2": 0.8611, "train_stride": 6, "lambda1": 0.28, "transition_loss_weight": 2}	kept	[TW EVID 4CAM UNC w=2] cls_trans 0.5012->0.5404, mse -2.4%
EvidentialLSTM	0.016986	0.025851	0.097294	0.129130	0.931524	0.943222	0.581986	0.497475	0.850599	0.945863	0.160088	0.081496	0.932003	0.942782	0.579677	0.500000	6265	4544	{"cfg": "EVID 4CAM UNC", "mode": "evidential", "n_features": 65, "hidden_size": 128, "n_layers": 4, "dropout": 0.4, "lr": 0.003, "batch_size": 64, "sub_window": 6, "n_steps": 5, "warmup_frames": 300, "t1_percentile": 20, "t2_percentile": 90, "t1": 0.1944, "t2": 0.8611, "train_stride": 6, "lambda1": 0.28, "transition_loss_weight": 3}	kept	[TW EVID 4CAM UNC w=3] cls_trans 0.5012->0.5820, mse +6.4%
EvidentialLSTM	0.017278	0.028813	0.097325	0.135301	0.921628	0.940141	0.579677	0.500000	0.850599	0.945863	0.100818	0.056640	0.921628	0.939921	0.575058	0.500000	6265	4544	{"cfg": "EVID 4CAM UNC", "mode": "evidential", "n_features": 65, "hidden_size": 128, "n_layers": 4, "dropout": 0.4, "lr": 0.003, "batch_size": 64, "sub_window": 6, "n_steps": 5, "warmup_frames": 300, "t1_percentile": 20, "t2_percentile": 90, "t1": 0.1944, "t2": 0.8611, "train_stride": 6, "lambda1": 0.28, "transition_loss_weight": 5}	kept	[TW EVID 4CAM UNC w=5] cls_trans 0.5012->0.5797, mse +8.3%
