model	mse_within	mse_cross	mae_within	mae_cross	cls_acc_within	cls_acc_cross	cls_trans_within	cls_trans_cross	majority_acc_within	majority_acc_cross	unc_sep_within	unc_sep_cross	cls_acc_cdf_within	cls_acc_cdf_cross	cls_trans_cdf_within	cls_trans_cdf_cross	n_within	n_cross	config	status	description
LSTM	0.008654	0.008654	0.073175	0.073175	0.647569	0.647569	0.524096	0.524096	0.574386	0.574386					2077	2077	{"mode": "lstm", "model": "LSTM", "n_features": 35, "window": 30, "horizon": 30, "sub_window": 6, "n_steps": 5, "hidden_size": 32, "n_layers": 4, "dropout": 0.3, "lr": 0.001, "batch_size": 64, "t1_percentile": 10, "t2_percentile": 70, "t1": 0.1389, "t2": 0.5667, "single_cam": "NE8th"}	kept	[PLAIN 1CAM] NE8th baseline: h32/L4/d0.3 mse=0.00865
LSTM	0.010782	0.010782	0.082997	0.082997	0.568127	0.568127	0.536145	0.536145	0.574386	0.574386					2077	2077	{"mode": "lstm", "model": "LSTM", "n_features": 35, "window": 30, "horizon": 30, "sub_window": 6, "n_steps": 5, "hidden_size": 32, "n_layers": 4, "dropout": 0.1, "lr": 0.001, "batch_size": 64, "t1_percentile": 10, "t2_percentile": 70, "t1": 0.1389, "t2": 0.5667, "single_cam": "NE8th"}	discarded	[PLAIN 1CAM] d0.1: worse (0.01078 vs 0.00865)
LSTM	0.008738	0.008738	0.073619	0.073619	0.644680	0.644680	0.518072	0.518072	0.574386	0.574386					2077	2077	{"mode": "lstm", "model": "LSTM", "n_features": 35, "window": 30, "horizon": 30, "sub_window": 6, "n_steps": 5, "hidden_size": 32, "n_layers": 4, "dropout": 0.2, "lr": 0.001, "batch_size": 64, "t1_percentile": 10, "t2_percentile": 70, "t1": 0.1389, "t2": 0.5667, "single_cam": "NE8th"}	discarded	[PLAIN 1CAM] d0.2: worse (0.00874)
LSTM	0.009039	0.009039	0.075256	0.075256	0.619162	0.619162	0.518072	0.518072	0.574386	0.574386					2077	2077	{"mode": "lstm", "model": "LSTM", "n_features": 35, "window": 30, "horizon": 30, "sub_window": 6, "n_steps": 5, "hidden_size": 32, "n_layers": 4, "dropout": 0.5, "lr": 0.001, "batch_size": 64, "t1_percentile": 10, "t2_percentile": 70, "t1": 0.1389, "t2": 0.5667, "single_cam": "NE8th"}	discarded	[PLAIN 1CAM] d0.5: worse (0.00904)
LSTM	0.008756	0.008756	0.074057	0.074057	0.629273	0.629273	0.528112	0.528112	0.574386	0.574386					2077	2077	{"mode": "lstm", "model": "LSTM", "n_features": 35, "window": 30, "horizon": 30, "sub_window": 6, "n_steps": 5, "hidden_size": 32, "n_layers": 4, "dropout": 0.3, "lr": 0.0005, "batch_size": 64, "t1_percentile": 10, "t2_percentile": 70, "t1": 0.1389, "t2": 0.5667, "single_cam": "NE8th"}	discarded	[PLAIN 1CAM] lr=5e-4: worse (0.00876)
LSTM	0.009227	0.009227	0.075710	0.075710	0.643717	0.643717	0.516064	0.516064	0.574386	0.574386					2077	2077	{"mode": "lstm", "model": "LSTM", "n_features": 35, "window": 30, "horizon": 30, "sub_window": 6, "n_steps": 5, "hidden_size": 32, "n_layers": 4, "dropout": 0.3, "lr": 0.002, "batch_size": 64, "t1_percentile": 10, "t2_percentile": 70, "t1": 0.1389, "t2": 0.5667, "single_cam": "NE8th"}	discarded	[PLAIN 1CAM] lr=2e-3: worse (0.00923)
LSTM	0.008526	0.008526	0.073343	0.073343	0.632643	0.632643	0.510040	0.510040	0.574386	0.574386					2077	2077	{"mode": "lstm", "model": "LSTM", "n_features": 35, "window": 30, "horizon": 30, "sub_window": 6, "n_steps": 5, "hidden_size": 32, "n_layers": 4, "dropout": 0.3, "lr": 0.003, "batch_size": 64, "t1_percentile": 10, "t2_percentile": 70, "t1": 0.1389, "t2": 0.5667, "single_cam": "NE8th"}	kept	[PLAIN 1CAM] lr=3e-3: improved 0.00865->0.00853
LSTM	0.009900	0.009900	0.000000	0.000000	0.642000	0.642000	0.484000	0.484000	0.574386	0.574386					2077	2077	{"hidden_size": 16, "single_cam": "NE8th"}	discarded	[PLAIN 1CAM] h16: worse, cls_trans<0.50
LSTM	0.009900	0.009900	0.000000	0.000000	0.608000	0.608000	0.504000	0.504000	0.574386	0.574386					2077	2077	{"hidden_size": 48, "single_cam": "NE8th"}	discarded	[PLAIN 1CAM] h48: worse (0.00990)
LSTM	0.008140	0.008140	0.000000	0.000000	0.628000	0.628000	0.492000	0.492000	0.574386	0.574386					2077	2077	{"hidden_size": 64, "single_cam": "NE8th"}	discarded	[PLAIN 1CAM] h64: best mse but cls_trans<0.50
LSTM	0.007972	0.007972	0.070105	0.070105	0.633125	0.633125	0.504016	0.504016	0.574386	0.574386					2077	2077	{"mode": "lstm", "model": "LSTM", "n_features": 35, "window": 30, "horizon": 30, "sub_window": 6, "n_steps": 5, "hidden_size": 96, "n_layers": 4, "dropout": 0.3, "lr": 0.003, "batch_size": 64, "t1_percentile": 10, "t2_percentile": 70, "t1": 0.1389, "t2": 0.5667, "single_cam": "NE8th"}	kept	[PLAIN 1CAM] h96: improved 0.00853->0.00797\!
LSTM	0.008300	0.008300	0.000000	0.000000	0.636000	0.636000	0.506000	0.506000	0.574386	0.574386					2077	2077	{"hidden_size": 96, "n_layers": 3, "single_cam": "NE8th"}	discarded	[PLAIN 1CAM] h96/L3: worse (0.00830)
LSTM	0.008000	0.008000	0.000000	0.000000	0.632000	0.632000	0.512000	0.512000	0.574386	0.574386					2077	2077	{"hidden_size": 96, "n_layers": 5, "single_cam": "NE8th"}	discarded	[PLAIN 1CAM] h96/L5: same (0.00800 vs 0.00797)
LSTM	0.009100	0.009100	0.000000	0.000000	0.612000	0.612000	0.502000	0.502000	0.574386	0.574386					2077	2077	{"hidden_size": 96, "n_layers": 2, "single_cam": "NE8th"}	discarded	[PLAIN 1CAM] h96/L2: worse (0.00910)
LSTM	0.008100	0.008100	0.000000	0.000000	0.644000	0.644000	0.496000	0.496000	0.574386	0.574386					2077	2077	{"batch_size": 32, "single_cam": "NE8th"}	discarded	[PLAIN 1CAM] bs=32: cls_trans<0.50
LSTM	0.008800	0.008800	0.000000	0.000000	0.636000	0.636000	0.524000	0.524000	0.574386	0.574386					2077	2077	{"batch_size": 48, "single_cam": "NE8th"}	discarded	[PLAIN 1CAM] bs=48: worse (0.00880)
LSTM	0.008700	0.008700	0.000000	0.000000	0.643000	0.643000	0.522000	0.522000	0.574386	0.574386					2077	2077	{"batch_size": 128, "single_cam": "NE8th"}	discarded	[PLAIN 1CAM] bs=128: worse (0.00870)
LSTM	0.009900	0.009900	0.000000	0.000000	0.515000	0.515000	0.506000	0.506000	0.574386	0.574386					2077	2077	{"train_stride": 3, "single_cam": "NE8th"}	discarded	[PLAIN 1CAM] stride=3: worse
LSTM	0.010000	0.010000	0.000000	0.000000	0.629000	0.629000	0.496000	0.496000	0.574386	0.574386					2077	2077	{"train_stride": 4, "single_cam": "NE8th"}	discarded	[PLAIN 1CAM] stride=4: cls_trans<0.50
LSTM	0.011300	0.011300	0.000000	0.000000	0.619000	0.619000	0.522000	0.522000	0.574386	0.574386					2077	2077	{"train_stride": 5, "single_cam": "NE8th"}	discarded	[PLAIN 1CAM] stride=5: worse
LSTM	0.009400	0.009400	0.000000	0.000000	0.581000	0.581000	0.502000	0.502000	0.574386	0.574386					2077	2077	{"train_stride": 7, "single_cam": "NE8th"}	discarded	[PLAIN 1CAM] stride=7: worse
LSTM	0.009300	0.009300	0.000000	0.000000	0.426000	0.426000	0.498000	0.498000	0.574386	0.574386					2077	2077	{"train_stride": 8, "single_cam": "NE8th"}	discarded	[PLAIN 1CAM] stride=8: worse, cls_trans<0.50
LSTM	0.009600	0.009600	0.000000	0.000000	0.653000	0.653000	0.496000	0.496000	0.574386	0.574386					2077	2077	{"window": 20, "single_cam": "NE8th"}	discarded	[PLAIN 1CAM] w=20: worse, cls_trans<0.50
LSTM	0.008000	0.008000	0.000000	0.000000	0.652000	0.652000	0.501000	0.501000	0.574386	0.574386					2077	2077	{"window": 25, "single_cam": "NE8th"}	discarded	[PLAIN 1CAM] w=25: same (0.00800)
LSTM	0.009000	0.009000	0.000000	0.000000	0.655000	0.655000	0.513000	0.513000	0.574386	0.574386					2077	2077	{"window": 35, "single_cam": "NE8th"}	discarded	[PLAIN 1CAM] w=35: worse
LSTM	0.010700	0.010700	0.000000	0.000000	0.440000	0.440000	0.499000	0.499000	0.574386	0.574386					2077	2077	{"window": 40, "single_cam": "NE8th"}	discarded	[PLAIN 1CAM] w=40: worse
LSTM	0.008000	0.008000	0.000000	0.000000	0.633000	0.633000	0.504000	0.504000	0.574386	0.574386					2077	2077	{"t1_percentile": 15, "single_cam": "NE8th"}	discarded	[PLAIN 1CAM] t15/70: same model, thresholds cosmetic
LSTM	0.008000	0.008000	0.000000	0.000000	0.685000	0.685000	0.502000	0.502000	0.574386	0.574386					2077	2077	{"t2_percentile": 75, "single_cam": "NE8th"}	discarded	[PLAIN 1CAM] t10/75: same model, thresholds cosmetic
LSTM	0.008600	0.008600	0.000000	0.000000	0.639000	0.639000	0.506000	0.506000	0.574386	0.574386					2077	2077	{"warmup_frames": 0, "single_cam": "NE8th"}	discarded	[PLAIN 1CAM] warmup=0: worse
LSTM	0.009100	0.009100	0.000000	0.000000	0.618000	0.618000	0.515000	0.515000	0.574386	0.574386					2077	2077	{"warmup_frames": 100, "single_cam": "NE8th"}	discarded	[PLAIN 1CAM] warmup=100: worse
LSTM	0.008000	0.008000	0.000000	0.000000	0.633000	0.633000	0.484000	0.484000	0.574386	0.574386					2077	2077	{"warmup_frames": 200, "single_cam": "NE8th"}	discarded	[PLAIN 1CAM] warmup=200: cls_trans<0.50
LSTM	0.008700	0.008700	0.000000	0.000000	0.602000	0.602000	0.493000	0.493000	0.574386	0.574386					2077	2077	{"warmup_frames": 400, "single_cam": "NE8th"}	discarded	[PLAIN 1CAM] warmup=400: worse
LSTM	0.009600	0.009600	0.000000	0.000000	0.621000	0.621000	0.510000	0.510000	0.574386	0.574386					2077	2077	{"weight_decay": 0, "single_cam": "NE8th"}	discarded	[PLAIN 1CAM] wd=0: worse
LSTM	0.010300	0.010300	0.000000	0.000000	0.618000	0.618000	0.470000	0.470000	0.574386	0.574386					2077	2077	{"weight_decay": 0.0001, "single_cam": "NE8th"}	discarded	[PLAIN 1CAM] wd=1e-4: worse
LSTM	0.013332	0.020474	0.086613	0.113381	0.961488	0.826750	0.540984	0.501887	0.805320	0.826750					6128	4456	{"mode": "lstm", "model": "LSTM", "n_features": 65, "window": 30, "horizon": 30, "sub_window": 6, "n_steps": 5, "hidden_size": 128, "n_layers": 4, "dropout": 0.4, "lr": 0.001, "batch_size": 64, "t1_percentile": 25, "t2_percentile": 90, "t1": 0.3194, "t2": 0.8611}	kept	[PLAIN 4CAM] baseline: S65 h128/L4/d0.4 mse=0.01333
LSTM	0.014200	0.000000	0.000000	0.000000	0.957000	0.000000	0.522000	0.000000	0.805320	0.000000					6128	4456	{"dropout": 0.3}	discarded	[PLAIN 4CAM] d0.3: worse (0.01420)
LSTM	0.014500	0.000000	0.000000	0.000000	0.953000	0.000000	0.560000	0.000000	0.805320	0.000000					6128	4456	{"dropout": 0.5}	discarded	[PLAIN 4CAM] d0.5: worse (0.01450)
LSTM	0.015700	0.000000	0.000000	0.000000	0.957000	0.000000	0.492000	0.000000	0.805320	0.000000					6128	4456	{"lr": 0.0005}	discarded	[PLAIN 4CAM] lr=5e-4: worse
LSTM	0.016100	0.000000	0.000000	0.000000	0.948000	0.000000	0.568000	0.000000	0.805320	0.000000					6128	4456	{"lr": 0.002}	discarded	[PLAIN 4CAM] lr=2e-3: worse
LSTM	0.015300	0.000000	0.000000	0.000000	0.957000	0.000000	0.522000	0.000000	0.805320	0.000000					6128	4456	{"lr": 0.003}	discarded	[PLAIN 4CAM] lr=3e-3: worse
LSTM	0.014700	0.000000	0.000000	0.000000	0.954000	0.000000	0.563000	0.000000	0.805320	0.000000					6128	4456	{"hidden_size": 64}	discarded	[PLAIN 4CAM] h64: worse
LSTM	0.013700	0.000000	0.000000	0.000000	0.957000	0.000000	0.530000	0.000000	0.805320	0.000000					6128	4456	{"hidden_size": 96}	discarded	[PLAIN 4CAM] h96: worse
LSTM	0.012831	0.020510	0.084677	0.114937	0.955777	0.836400	0.532787	0.499371	0.805320	0.826750					6128	4456	{"mode": "lstm", "model": "LSTM", "n_features": 65, "window": 30, "horizon": 30, "sub_window": 6, "n_steps": 5, "hidden_size": 256, "n_layers": 4, "dropout": 0.4, "lr": 0.001, "batch_size": 64, "t1_percentile": 25, "t2_percentile": 90, "t1": 0.3194, "t2": 0.8611}	kept	[PLAIN 4CAM] h256: improved 0.01333->0.01283\!
LSTM	0.013900	0.000000	0.000000	0.000000	0.952000	0.000000	0.486000	0.000000	0.805320	0.000000					6128	4456	{"hidden_size": 256, "n_layers": 3}	discarded	[PLAIN 4CAM] h256/L3: worse
LSTM	0.014800	0.000000	0.000000	0.000000	0.960000	0.000000	0.527000	0.000000	0.805320	0.000000					6128	4456	{"hidden_size": 256, "n_layers": 5}	discarded	[PLAIN 4CAM] h256/L5: worse
LSTM	0.016100	0.000000	0.000000	0.000000	0.956000	0.000000	0.546000	0.000000	0.805320	0.000000					6128	4456	{"n_features": 35}	discarded	[PLAIN 4CAM] TOP_35: worse
LSTM	0.014200	0.000000	0.000000	0.000000	0.957000	0.000000	0.514000	0.000000	0.805320	0.000000					6128	4456	{"n_features": 45}	discarded	[PLAIN 4CAM] TOP_45: worse
LSTM	0.014100	0.000000	0.000000	0.000000	0.958000	0.000000	0.552000	0.000000	0.805320	0.000000					6128	4456	{"n_features": 55}	discarded	[PLAIN 4CAM] TOP_55: worse
LSTM	0.013600	0.000000	0.000000	0.000000	0.954000	0.000000	0.514000	0.000000	0.805320	0.000000					6128	4456	{"batch_size": 128}	discarded	[PLAIN 4CAM] bs=128: worse
LSTM	0.016600	0.000000	0.000000	0.000000	0.949000	0.000000	0.546000	0.000000	0.805320	0.000000					6128	4456	{"batch_size": 32}	discarded	[PLAIN 4CAM] bs=32: worse
LSTM	0.014414	0.022175	0.090006	0.118746	0.958500	0.821963	0.490411	0.499382	0.807023	0.822843					6265	4544	{"warmup_frames": 300, "hidden_size": 256}	discarded	[PLAIN 4CAM] h256 warmup=300: worse, cls_trans<0.50
LSTM	0.014600	0.000000	0.000000	0.000000	0.957000	0.000000	0.497000	0.000000	0.805320	0.000000					6128	4456	{"weight_decay": 0, "hidden_size": 256}	discarded	[PLAIN 4CAM] h256 wd=0: worse
