model	mse_within	mse_cross	mae_within	mae_cross	cls_acc_within	cls_acc_cross	cls_trans_within	cls_trans_cross	majority_acc_within	majority_acc_cross	unc_sep_within	unc_sep_cross	cls_acc_cdf_within	cls_acc_cdf_cross	cls_trans_cdf_within	cls_trans_cdf_cross	n_within	n_cross	config	status	description
EvidentialLSTM	0.011204	0.018104	0.076355	0.107269	0.936313	0.941241	0.481855	0.498824	0.844533	0.941241	0.195190	0.121459	0.936472	0.941241	0.487903	0.498824	6265	4544	{"lr":0.002,"stride":6}	discard	lr2e-3+L4+s6: cls_trans<0.50
EvidentialLSTM	0.010672	0.025339	0.075812	0.123978	0.949242	0.945863	0.524249	0.500000	0.850599	0.945863	0.124222	0.060795	0.949561	0.945863	0.519630	0.500000	6265	4544	{"lambda1":0.25,"t2_percentile":90}	discard	t2p90+λ0.25: cross guard violated
EvidentialLSTM	0.012428	0.023500	0.079703	0.121205	0.934717	0.940801	0.536290	0.498824	0.844533	0.941241	0.098956	0.066636	0.933919	0.940801	0.528226	0.498824	6265	4544	{"weight_decay":0,"lambda1":0.25}	discard	wd0+λ0.25: mse worse
EvidentialLSTM	0.011825	0.018549	0.076491	0.107745	0.934717	0.942342	0.511719	0.498801	0.846608	0.942342	0.083165	0.045446	0.933759	0.942342	0.505859	0.498801	6265	4544	{"train_stride":3}	discard	s3: mse worse (too much overlap)
EvidentialLSTM	0.011958	0.018178	0.078302	0.107181	0.936951	0.941461	0.502016	0.501176	0.844533	0.941241	0.147791	0.107424	0.937111	0.941241	0.504032	0.498824	6265	4544	{"batch_size":48,"stride":6}	discard	bs48+L4+s6: mse worse
EvidentialLSTM	0.011480	0.020298	0.076563	0.113486	0.933599	0.941461	0.512097	0.498824	0.844533	0.941241	0.131605	0.080193	0.934397	0.941461	0.522177	0.498824	6265	4544	{"lr":5e-4,"stride":6}	discard	lr5e-4+L4+s6: mse worse
EvidentialLSTM	0.011372	0.026221	0.075322	0.124211	0.939665	0.835167	0.538306	0.470588	0.844533	0.941241	0.111857	0.128129	0.939824	0.827685	0.536290	0.477647	6265	4544	{"lambda1":0.25,"n_layers":3,"stride":6}	discard	λ0.25+L3+s6: mse worse
EvidentialLSTM	0.011505	0.029487	0.076895	0.134935	0.949158	0.954475	0.520697	0.516779	0.860305	0.959779	0.172666	0.111192	0.944988	0.951160	0.498911	0.523490	6235	4525	{"window":45}	discard	w45: mse worse + cross guard
EvidentialLSTM	0.011243	0.021577	0.073814	0.114073	0.932115	0.958483	0.510870	0.501684	0.859171	0.958259	0.106200	0.059960	0.930809	0.958483	0.510870	0.501684	6128	4456	{"grad_clip":0.8,"warmup":400}	discard	gc0.8+w400: mse worse + cross guard
EvidentialLSTM	0.015116	0.023866	0.092566	0.122920	0.930886	0.938820	0.512097	0.498824	0.844533	0.941241	0.143713	0.072065	0.932322	0.938820	0.524194	0.498824	6265	4544	{"features":"SPATIAL_65","dropout":0.3,"n_layers":4}	info	SPATIAL65_test1: d0.3+L4+s6
EvidentialLSTM	0.015453	0.032074	0.092676	0.141404	0.928492	0.941021	0.528226	0.501176	0.844533	0.941241	0.229406	0.068583	0.928811	0.940801	0.526210	0.501176	6265	4544	{"features":"SPATIAL_65","dropout":0.5,"n_layers":4}	info	SPATIAL65_test2: d0.5+L4+s6
EvidentialLSTM	0.017167	0.024189	0.097022	0.125234	0.916840	0.937500	0.528226	0.498824	0.844533	0.941241	0.211749	0.094397	0.919074	0.937280	0.522177	0.498824	6265	4544	{"features":"SPATIAL_65","n_layers":3}	info	SPATIAL65_test3: L3+s6
EvidentialLSTM	0.014959	0.021466	0.089837	0.119122	0.936472	0.941021	0.518145	0.501176	0.844533	0.941241	0.248906	0.119702	0.936632	0.941021	0.522177	0.501176	6265	4544	{"features":"SPATIAL_65","hidden_size":64,"n_layers":4}	info	SPATIAL65_test4: h64+L4+s6
EvidentialLSTM	0.015686	0.019616	0.092685	0.111071	0.931419	0.943247	0.520325	0.501241	0.848485	0.943247	0.242904	0.209234	0.930941	0.943247	0.518293	0.501241	6270	4546	{"features":"SPATIAL_65","window":20}	info	SPATIAL65_test5: w20+L4+s6
EvidentialLSTM	0.016010	0.030796	0.092346	0.140019	0.931045	0.967650	0.537129	0.506224	0.864326	0.967650	0.675735	0.162803	0.930407	0.967650	0.532178	0.506224	6265	4544	{"features":"SPATIAL_65","sub_window":3}	info	SPATIAL65_test6: S3+L4+s6
EvidentialLSTM	0.014940	0.032299	0.090846	0.143845	0.942698	0.939921	0.514113	0.498824	0.844533	0.941241	0.141886	0.060834	0.941261	0.939481	0.504032	0.498824	6265	4544	{"features":"SPATIAL_65","patience":60}	info	SPATIAL65_test7: p60+L4+s6
EvidentialLSTM	0.016233	0.026315	0.097733	0.129982	0.931524	0.942562	0.488281	0.501211	0.846927	0.942782	0.064579	0.069379	0.932322	0.942342	0.494141	0.498789	6265	4544	{"features":"SPATIAL_65","lr":5e-4,"train_stride":4}	info	SPATIAL65_test8: lr5e-4+s4+L4
