model	mse_within	mse_cross	mae_within	mae_cross	cls_acc_within	cls_acc_cross	cls_trans_within	cls_trans_cross	majority_acc_within	majority_acc_cross	unc_sep_within	unc_sep_cross	cls_acc_cdf_within	cls_acc_cdf_cross	cls_trans_cdf_within	cls_trans_cdf_cross	n_within	n_cross	config	status	description
EvidentialLSTM	0.015736	0.029626	0.094439	0.133993	0.933919	0.940581	0.586605	0.517677	0.850599	0.945863	0.199194	0.132921	0.934397	0.939040	0.595843	0.522727	6265	4544	{"cfg": "EVID 4CAM UNC", "mode": "evidential", "n_features": 65, "hidden_size": 128, "n_layers": 4, "dropout": 0.4, "lr": 0.003, "batch_size": 64, "sub_window": 6, "n_steps": 5, "warmup_frames": 300, "t1_percentile": 20, "t2_percentile": 90, "t1": 0.1944, "t2": 0.8611, "train_stride": 6, "lambda1": 0.28, "transition_loss_weight": 8}	kept	[TW EVID 4CAM UNC w=8] cls_trans 0.5012->0.5866, mse -1.4%
EvidentialLSTM	0.016458	0.025314	0.094879	0.126902	0.920351	0.939261	0.646651	0.505051	0.850599	0.945863	0.087030	0.081289	0.924342	0.939261	0.623557	0.507576	6265	4544	{"cfg": "EVID 4CAM UNC", "mode": "evidential", "n_features": 65, "hidden_size": 128, "n_layers": 4, "dropout": 0.4, "lr": 0.003, "batch_size": 64, "sub_window": 6, "n_steps": 5, "warmup_frames": 300, "t1_percentile": 20, "t2_percentile": 90, "t1": 0.1944, "t2": 0.8611, "train_stride": 6, "lambda1": 0.28, "transition_loss_weight": 10}	kept	[TW EVID 4CAM UNC w=10] cls_trans 0.5012->0.6467, mse +3.1%
EvidentialLSTM	0.015408	0.021736	0.090367	0.117245	0.942857	0.945863	0.524249	0.500000	0.850599	0.945863	0.204378	0.111220	0.942698	0.945863	0.528868	0.500000	6265	4544	{"cfg": "EVID 4CAM UNC", "mode": "evidential", "n_features": 81, "hidden_size": 128, "n_layers": 4, "dropout": 0.4, "lr": 0.003, "batch_size": 64, "sub_window": 6, "n_steps": 5, "warmup_frames": 300, "t1_percentile": 20, "t2_percentile": 90, "t1": 0.1944, "t2": 0.8611, "train_stride": 6, "lambda1": 0.28, "use_delta_features": true}	kept	[DELTA EVID 4CAM UNC] cls_trans 0.5012->0.5242, mse -3.4%
EvidentialLSTM	0.017871	0.024510	0.095159	0.122827	1.000000	0.999780	0.000000	0.500000	1.000000	0.999780	0.000000	0.865104	1.000000	0.999780	0.000000	0.500000	6265	4544	{"cfg": "EVID 4CAM UNC", "mode": "evidential", "n_features": 65, "hidden_size": 128, "n_layers": 4, "dropout": 0.4, "lr": 0.003, "batch_size": 64, "sub_window": 1, "n_steps": 30, "warmup_frames": 300, "t1_percentile": 20, "t2_percentile": 90, "t1": 0.0, "t2": 1.0, "train_stride": 6, "lambda1": 0.28}	discarded	[SW1 EVID 4CAM UNC] cls_trans 0.0000 <= baseline 0.5012
EvidentialLSTM	0.018683	0.034555	0.099905	0.149819	1.000000	0.999780	0.000000	0.500000	1.000000	0.999780	0.000000	0.243001	1.000000	0.999780	0.000000	0.500000	6265	4544	{"cfg": "EVID 4CAM UNC", "mode": "evidential", "n_features": 65, "hidden_size": 128, "n_layers": 4, "dropout": 0.4, "lr": 0.003, "batch_size": 64, "sub_window": 2, "n_steps": 15, "warmup_frames": 300, "t1_percentile": 20, "t2_percentile": 90, "t1": 0.0, "t2": 1.0, "train_stride": 6, "lambda1": 0.28}	discarded	[SW2 EVID 4CAM UNC] cls_trans 0.0000 <= baseline 0.5012
EvidentialLSTM	0.018878	0.049780	0.097834	0.172837	0.915563	0.743398	0.581986	0.484848	0.850599	0.945863	0.059823	0.081346	0.913488	0.734155	0.572748	0.484848	6265	4544	{"cfg": "EVID 4CAM UNC", "mode": "evidential", "n_features": 81, "hidden_size": 128, "n_layers": 4, "dropout": 0.4, "lr": 0.003, "batch_size": 64, "sub_window": 6, "n_steps": 5, "warmup_frames": 300, "t1_percentile": 20, "t2_percentile": 90, "t1": 0.1944, "t2": 0.8611, "train_stride": 6, "lambda1": 0.28, "transition_loss_weight": 10, "use_delta_features": true}	discarded	[COMBO TW+DELTA EVID 4CAM UNC] mse +18.3% > 10% threshold
EvidentialLSTM	0.009302	0.009302	0.075907	0.075907	0.646606	0.646606	0.508032	0.508032	0.574386	0.574386	0.001845	0.001845	0.644680	0.644680	0.504016	0.504016	2077	2077	{"cfg": "EVID 1CAM", "mode": "evidential", "n_features": 35, "hidden_size": 32, "n_layers": 4, "dropout": 0.3, "lr": 0.003, "batch_size": 64, "sub_window": 6, "n_steps": 5, "warmup_frames": 300, "t1_percentile": 10, "t2_percentile": 70, "t1": 0.1389, "t2": 0.5667, "train_stride": 6, "lambda1": 0.25, "single_cam": "Bellevue_Bellevue_NE8th"}	baseline	[BASELINE EVID 1CAM]
