model	mse_within	mse_cross	mae_within	mae_cross	cls_acc_within	cls_acc_cross	cls_trans_within	cls_trans_cross	majority_acc_within	majority_acc_cross	n_within	n_cross	config	status	description
LSTM	0.016274	0.022796	0.098507	0.118320	0.986987	0.984832	0.512821	0.495146	0.989652	0.984832	6378	4615	{"mode":"lstm","model":"LSTM","n_features":35,"window":30,"horizon":30,"sub_window":6,"n_steps":5,"hidden_size":128,"n_layers":2,"dropout":0.4,"lr":0.001,"batch_size":64,"t1_percentile":10,"t2_percentile":85,"t1":0.0,"t2":0.8333}	kept	baseline default config
LSTM	0.016274	0.022796	0.098507	0.118320	0.933208	0.942795	0.532129	0.498783	0.848228	0.943012	6378	4615	{"mode":"lstm","model":"LSTM","n_features":35,"window":30,"horizon":30,"sub_window":6,"n_steps":5,"hidden_size":128,"n_layers":2,"dropout":0.4,"lr":0.001,"batch_size":64,"t1_percentile":20,"t2_percentile":85,"t1":0.175,"t2":0.8333}	kept	t1_percentile=20
LSTM	0.016274	0.022796	0.098507	0.118320	0.947632	0.839870	0.524887	0.507426	0.800408	0.822535	6378	4615	{"mode":"lstm","model":"LSTM","n_features":35,"window":30,"horizon":30,"sub_window":6,"n_steps":5,"hidden_size":128,"n_layers":2,"dropout":0.4,"lr":0.001,"batch_size":64,"t1_percentile":25,"t2_percentile":85,"t1":0.3221,"t2":0.8333}	discarded	t1_percentile=25 (cls_trans_within worse)
LSTM	0.016274	0.022796	0.098507	0.118320	0.946221	0.833586	0.515556	0.504785	0.797272	0.808884	6378	4615	{"mode":"lstm","model":"LSTM","n_features":35,"window":30,"horizon":30,"sub_window":6,"n_steps":5,"hidden_size":128,"n_layers":2,"dropout":0.4,"lr":0.001,"batch_size":64,"t1_percentile":30,"t2_percentile":85,"t1":0.3333,"t2":0.8333}	discarded	t1_percentile=30 (cls_trans worse)
LSTM	0.016274	0.022796	0.098507	0.118320	0.946221	0.836836	0.513393	0.514085	0.795547	0.795450	6378	4615	{"mode":"lstm","model":"LSTM","n_features":35,"window":30,"horizon":30,"sub_window":6,"n_steps":5,"hidden_size":128,"n_layers":2,"dropout":0.4,"lr":0.001,"batch_size":64,"t1_percentile":33,"t2_percentile":85,"t1":0.3386,"t2":0.8333}	discarded	t1_percentile=33 (cls_trans worse)
LSTM	0.016274	0.022796	0.098507	0.118320	0.640169	0.758397	0.523931	0.516844	0.631546	0.787866	6378	4615	{"mode":"lstm","model":"LSTM","n_features":35,"window":30,"horizon":30,"sub_window":6,"n_steps":5,"hidden_size":128,"n_layers":2,"dropout":0.4,"lr":0.001,"batch_size":64,"t1_percentile":20,"t2_percentile":67,"t1":0.175,"t2":0.6667}	discarded	t2_percentile=67 (cls_trans worse)
LSTM	0.016274	0.022796	0.098507	0.118320	0.640169	0.758397	0.523931	0.516844	0.631546	0.787866	6378	4615	{"mode":"lstm","model":"LSTM","n_features":35,"window":30,"horizon":30,"sub_window":6,"n_steps":5,"hidden_size":128,"n_layers":2,"dropout":0.4,"lr":0.001,"batch_size":64,"t1_percentile":20,"t2_percentile":70,"t1":0.175,"t2":0.6667}	discarded	t2_percentile=70 (same as p67)
LSTM	0.016274	0.022796	0.098507	0.118320	0.678896	0.810834	0.513869	0.497955	0.693948	0.836186	6378	4615	{"mode":"lstm","model":"LSTM","n_features":35,"window":30,"horizon":30,"sub_window":6,"n_steps":5,"hidden_size":128,"n_layers":2,"dropout":0.4,"lr":0.001,"batch_size":64,"t1_percentile":20,"t2_percentile":75,"t1":0.175,"t2":0.6944}	discarded	t2_percentile=75 (cls_trans worse)
LSTM	0.016274	0.022796	0.098507	0.118320	0.821888	0.902492	0.508269	0.498423	0.792568	0.906826	6378	4615	{"mode":"lstm","model":"LSTM","n_features":35,"window":30,"horizon":30,"sub_window":6,"n_steps":5,"hidden_size":128,"n_layers":2,"dropout":0.4,"lr":0.001,"batch_size":64,"t1_percentile":20,"t2_percentile":80,"t1":0.175,"t2":0.754}	discarded	t2_percentile=80 (cls_trans worse)
LSTM	0.014900	0.027199	0.094089	0.129020	0.933208	0.942362	0.493976	0.498783	0.848228	0.943012	6378	4615	{"mode":"lstm","model":"LSTM","n_features":35,"window":30,"horizon":30,"sub_window":6,"n_steps":5,"hidden_size":64,"n_layers":2,"dropout":0.4,"lr":0.001,"batch_size":64,"t1_percentile":20,"t2_percentile":85,"t1":0.175,"t2":0.8333}	discarded	hidden=64 (cls_trans<0.50 + cross_mse +19%)
LSTM	0.016057	0.026045	0.098203	0.127632	0.934776	0.943012	0.497992	0.498783	0.848228	0.943012	6378	4615	{"mode":"lstm","model":"LSTM","n_features":35,"window":30,"horizon":30,"sub_window":6,"n_steps":5,"hidden_size":32,"n_layers":2,"dropout":0.4,"lr":0.001,"batch_size":64,"t1_percentile":20,"t2_percentile":85,"t1":0.175,"t2":0.8333}	discarded	hidden=32 (cls_trans<0.50)
LSTM	0.013829	0.027123	0.089086	0.127955	0.934149	0.934995	0.493976	0.496350	0.848228	0.943012	6378	4615	{"mode":"lstm","model":"LSTM","n_features":35,"window":30,"horizon":30,"sub_window":6,"n_steps":5,"hidden_size":128,"n_layers":1,"dropout":0.4,"lr":0.001,"batch_size":64,"t1_percentile":20,"t2_percentile":85,"t1":0.175,"t2":0.8333}	discarded	n_layers=1 (cls_trans<0.50 + cross_mse +19%)
LSTM	0.015410	0.020893	0.096025	0.114594	0.935403	0.943012	0.520080	0.498783	0.848228	0.943012	6378	4615	{"mode":"lstm","model":"LSTM","n_features":35,"window":30,"horizon":30,"sub_window":6,"n_steps":5,"hidden_size":128,"n_layers":3,"dropout":0.4,"lr":0.001,"batch_size":64,"t1_percentile":20,"t2_percentile":85,"t1":0.175,"t2":0.8333}	kept	n_layers=3 (mse_within -5.3%, mse_cross -8.3%)
LSTM	0.015944	0.023008	0.096331	0.119021	0.934462	0.942795	0.522088	0.498783	0.848228	0.943012	6378	4615	{"mode":"lstm","model":"LSTM","n_features":35,"window":30,"horizon":30,"sub_window":6,"n_steps":5,"hidden_size":128,"n_layers":3,"dropout":0.3,"lr":0.001,"batch_size":64,"t1_percentile":20,"t2_percentile":85,"t1":0.175,"t2":0.8333}	discarded	dropout=0.3 (mse_within worse)
LSTM	0.015073	0.020673	0.093225	0.113768	0.933678	0.943012	0.514056	0.498783	0.848228	0.943012	6378	4615	{"mode":"lstm","model":"LSTM","n_features":35,"window":30,"horizon":30,"sub_window":6,"n_steps":5,"hidden_size":128,"n_layers":3,"dropout":0.2,"lr":0.001,"batch_size":64,"t1_percentile":20,"t2_percentile":85,"t1":0.175,"t2":0.8333}	discarded	dropout=0.2 (mse_within worse)
LSTM	0.014500	0.020008	0.091220	0.113200	0.938382	0.943012	0.512048	0.498783	0.848228	0.943012	6378	4615	{"mode":"lstm","model":"LSTM","n_features":35,"window":30,"horizon":30,"sub_window":6,"n_steps":5,"hidden_size":128,"n_layers":3,"dropout":0.1,"lr":0.001,"batch_size":64,"t1_percentile":20,"t2_percentile":85,"t1":0.175,"t2":0.8333}	kept	dropout=0.1 (mse_within -5.9%, mse_cross -4.2%)
LSTM	0.014745	0.020298	0.092733	0.114181	0.934933	0.943012	0.526104	0.498783	0.848228	0.943012	6378	4615	{"mode":"lstm","model":"LSTM","n_features":35,"window":30,"horizon":30,"sub_window":6,"n_steps":5,"hidden_size":128,"n_layers":3,"dropout":0.1,"lr":0.0005,"batch_size":64,"t1_percentile":20,"t2_percentile":85,"t1":0.175,"t2":0.8333}	discarded	lr=5e-4 (mse_within worse)
LSTM	0.014511	0.021322	0.092205	0.117042	0.932894	0.943012	0.516064	0.498783	0.848228	0.943012	6378	4615	{"mode":"lstm","model":"LSTM","n_features":35,"window":30,"horizon":30,"sub_window":6,"n_steps":5,"hidden_size":128,"n_layers":3,"dropout":0.1,"lr":0.002,"batch_size":64,"t1_percentile":20,"t2_percentile":85,"t1":0.175,"t2":0.8333}	discarded	lr=2e-3 (mse_cross worse)
LSTM	0.015197	0.036182	0.094542	0.151498	0.935246	0.820368	0.514056	0.486618	0.848228	0.943012	6378	4615	{"mode":"lstm","model":"LSTM","n_features":35,"window":30,"horizon":30,"sub_window":6,"n_steps":5,"hidden_size":128,"n_layers":3,"dropout":0.1,"lr":0.0001,"batch_size":64,"t1_percentile":20,"t2_percentile":85,"t1":0.175,"t2":0.8333}	discarded	lr=1e-4 (underfitting, mse_cross +81%)
LSTM	0.013913	0.019967	0.089527	0.113864	0.934305	0.943012	0.516064	0.498783	0.848228	0.943012	6378	4615	{"mode":"lstm","model":"LSTM","n_features":35,"window":30,"horizon":30,"sub_window":6,"n_steps":5,"hidden_size":128,"n_layers":3,"dropout":0.1,"lr":0.001,"batch_size":32,"t1_percentile":20,"t2_percentile":85,"t1":0.175,"t2":0.8333}	kept	batch_size=32 (mse_within -4.0%)
LSTM	0.014288	0.024120	0.090813	0.120469	0.937284	0.943012	0.536145	0.498783	0.848228	0.943012	6378	4615	{"mode":"lstm","model":"LSTM","n_features":35,"window":30,"horizon":30,"sub_window":6,"n_steps":5,"hidden_size":128,"n_layers":3,"dropout":0.1,"lr":0.001,"batch_size":128,"t1_percentile":20,"t2_percentile":85,"t1":0.175,"t2":0.8333}	discarded	batch=128 (mse_cross +20%)
LSTM	0.015376	0.020580	0.094035	0.114189	0.937284	0.943012	0.540161	0.498783	0.848228	0.943012	6378	4615	{"mode":"lstm","model":"LSTM","n_features":35,"window":30,"horizon":30,"sub_window":6,"n_steps":5,"hidden_size":128,"n_layers":3,"dropout":0.1,"lr":0.001,"batch_size":32,"t1_percentile":20,"t2_percentile":85,"t1":0.175,"t2":0.8333,"weight_decay":0}	discarded	weight_decay=0 (mse_within worse)
LSTM	0.014455	0.048329	0.092656	0.171627	0.934305	0.759047	0.465863	0.491484	0.848228	0.943012	6378	4615	{"mode":"lstm","model":"LSTM","n_features":35,"window":30,"horizon":30,"sub_window":6,"n_steps":5,"hidden_size":128,"n_layers":3,"dropout":0.1,"lr":0.001,"batch_size":32,"t1_percentile":20,"t2_percentile":85,"t1":0.175,"t2":0.8333,"weight_decay":1e-4}	discarded	weight_decay=1e-4 (mse_cross +142%)
LSTM	0.013913	0.019967	0.089527	0.113864	0.934305	0.943012	0.516064	0.498783	0.848228	0.943012	6378	4615	{"mode":"lstm","model":"LSTM","n_features":35,"window":30,"horizon":30,"sub_window":6,"n_steps":5,"hidden_size":128,"n_layers":3,"dropout":0.1,"lr":0.001,"batch_size":32,"t1_percentile":20,"t2_percentile":85,"t1":0.175,"t2":0.8333,"patience":25}	discarded	patience=25 (same as 40)
LSTM	0.013913	0.019967	0.089527	0.113864	0.934305	0.943012	0.516064	0.498783	0.848228	0.943012	6378	4615	{"mode":"lstm","model":"LSTM","n_features":35,"window":30,"horizon":30,"sub_window":6,"n_steps":5,"hidden_size":128,"n_layers":3,"dropout":0.1,"lr":0.001,"batch_size":32,"t1_percentile":20,"t2_percentile":85,"t1":0.175,"t2":0.8333,"patience":60}	discarded	patience=60 (same results, slower)
LSTM	0.015482	0.025295	0.094993	0.123823	0.933051	0.943012	0.534137	0.498783	0.848228	0.943012	6378	4615	{"mode":"lstm","model":"LSTM","n_features":35,"window":30,"horizon":30,"sub_window":6,"n_steps":5,"hidden_size":128,"n_layers":3,"dropout":0.1,"lr":0.001,"batch_size":32,"t1_percentile":20,"t2_percentile":85,"t1":0.175,"t2":0.8333,"grad_clip":0.5}	discarded	grad_clip=0.5 (mse_within worse)
LSTM	0.014649	0.020124	0.091017	0.112627	0.936814	0.943012	0.522088	0.498783	0.848228	0.943012	6378	4615	{"mode":"lstm","model":"LSTM","n_features":35,"window":30,"horizon":30,"sub_window":6,"n_steps":5,"hidden_size":128,"n_layers":3,"dropout":0.1,"lr":0.001,"batch_size":32,"t1_percentile":20,"t2_percentile":85,"t1":0.175,"t2":0.8333,"grad_clip":2.0}	discarded	grad_clip=2.0 (mse_within worse)
LSTM	0.013545	0.023630	0.088063	0.124883	0.934619	0.943012	0.487952	0.498783	0.848228	0.943012	6378	4615	{"mode":"lstm","model":"LSTM","n_features":20,"window":30,"horizon":30,"sub_window":6,"n_steps":5,"hidden_size":128,"n_layers":3,"dropout":0.1,"lr":0.001,"batch_size":32,"t1_percentile":20,"t2_percentile":85,"t1":0.175,"t2":0.8333}	discarded	top-20 features (cls_trans<0.50)
LSTM	0.015079	0.027579	0.092207	0.131546	0.931483	0.942579	0.504016	0.498783	0.848228	0.943012	6378	4615	{"mode":"lstm","model":"LSTM","n_features":25,"window":30,"horizon":30,"sub_window":6,"n_steps":5,"hidden_size":128,"n_layers":3,"dropout":0.1,"lr":0.001,"batch_size":32,"t1_percentile":20,"t2_percentile":85,"t1":0.175,"t2":0.8333}	discarded	top-25 features (mse_within worse, mse_cross +38%)
LSTM	0.013662	0.052206	0.087692	0.181913	0.937128	0.779415	0.538153	0.503650	0.848228	0.943012	6378	4615	{"mode":"lstm","model":"LSTM","n_features":30,"window":30,"horizon":30,"sub_window":6,"n_steps":5,"hidden_size":128,"n_layers":3,"dropout":0.1,"lr":0.001,"batch_size":32,"t1_percentile":20,"t2_percentile":85,"t1":0.175,"t2":0.8333}	discarded	top-30 features (mse_cross +161%)
LSTM	0.013886	0.019516	0.089092	0.112479	0.938696	0.943012	0.495984	0.498783	0.848228	0.943012	6378	4615	{"mode":"lstm","model":"LSTM","n_features":65,"window":30,"horizon":30,"sub_window":6,"n_steps":5,"hidden_size":128,"n_layers":3,"dropout":0.1,"lr":0.001,"batch_size":32,"t1_percentile":20,"t2_percentile":85,"t1":0.175,"t2":0.8333}	discarded	SPATIAL_65 (cls_trans<0.50)
LSTM	0.010757	0.019853	0.074532	0.109538	0.936814	0.943012	0.495984	0.498783	0.848228	0.943012	6378	4615	{"mode":"lstm","model":"LSTM","n_features":75,"window":30,"horizon":30,"sub_window":6,"n_steps":5,"hidden_size":128,"n_layers":3,"dropout":0.1,"lr":0.001,"batch_size":32,"t1_percentile":20,"t2_percentile":85,"t1":0.175,"t2":0.8333}	discarded	ALL_75 features (cls_trans=0.496, barely <0.50)
LSTM	0.010971	0.019272	0.076601	0.109344	0.939479	0.943012	0.518072	0.498783	0.848228	0.943012	6378	4615	{"mode":"lstm","model":"LSTM","n_features":75,"window":30,"horizon":30,"sub_window":6,"n_steps":5,"hidden_size":128,"n_layers":3,"dropout":0.2,"lr":0.001,"batch_size":32,"t1_percentile":20,"t2_percentile":85,"t1":0.175,"t2":0.8333}	kept	ALL_75+dropout=0.2 (mse_within -21%, mse_cross -3.5%)
LSTM	0.014756	0.028546	0.092539	0.137312	0.928818	0.943012	0.477912	0.498783	0.848228	0.943012	6378	4615	{"mode":"lstm","model":"LSTM","n_features":10,"window":30,"horizon":30,"sub_window":6,"n_steps":5,"hidden_size":128,"n_layers":3,"dropout":0.2,"lr":0.001,"batch_size":32,"t1_percentile":20,"t2_percentile":85,"t1":0.175,"t2":0.8333}	discarded	top-10 features (cls_trans<0.50)
LSTM	0.015087	0.023158	0.095558	0.123813	0.932894	0.943012	0.514056	0.498783	0.848228	0.943012	6378	4615	{"mode":"lstm","model":"LSTM","n_features":15,"window":30,"horizon":30,"sub_window":6,"n_steps":5,"hidden_size":128,"n_layers":3,"dropout":0.2,"lr":0.001,"batch_size":32,"t1_percentile":20,"t2_percentile":85,"t1":0.175,"t2":0.8333}	discarded	top-15 features (mse_within worse)
LSTM	0.011377	0.021032	0.078774	0.111843	0.919436	0.918345	0.572395	0.500000	0.825235	0.918345	6380	4617	{"mode":"lstm","model":"LSTM","n_features":75,"window":30,"horizon":20,"sub_window":5,"n_steps":4,"hidden_size":128,"n_layers":3,"dropout":0.2,"lr":0.001,"batch_size":32,"t1_percentile":20,"t2_percentile":85,"t1":0.2,"t2":0.8}	discarded	horizon=20,sub_window=5 (mse_within worse)
LSTM	0.012038	0.027180	0.079819	0.124459	0.914630	0.903421	0.574519	0.507375	0.814536	0.905803	6384	4618	{"mode":"lstm","model":"LSTM","n_features":75,"window":30,"horizon":15,"sub_window":5,"n_steps":3,"hidden_size":128,"n_layers":3,"dropout":0.2,"lr":0.001,"batch_size":32,"t1_percentile":20,"t2_percentile":85,"t1":0.2,"t2":0.8}	discarded	horizon=15 (mse worse, cross +40%)
LSTM	0.013400	0.025675	0.079713	0.122515	0.901857	0.883736	0.576052	0.489286	0.806522	0.884167	6409	4636	{"mode":"lstm","model":"LSTM","n_features":75,"window":30,"horizon":10,"sub_window":5,"n_steps":2,"hidden_size":128,"n_layers":3,"dropout":0.2,"lr":0.001,"batch_size":32,"t1_percentile":20,"t2_percentile":85,"t1":0.2,"t2":0.8}	discarded	horizon=10 (mse both worse)
LSTM	0.010899	0.019737	0.075705	0.109485	0.954218	0.965980	0.507246	0.500000	0.864378	0.965980	6378	4615	{"mode":"lstm","model":"LSTM","n_features":75,"window":30,"horizon":30,"sub_window":3,"n_steps":10,"hidden_size":128,"n_layers":3,"dropout":0.2,"lr":0.001,"batch_size":32,"t1_percentile":20,"t2_percentile":85,"t1":0.1667,"t2":0.8667}	kept	sub_window=3 (mse_within -0.7%)
LSTM	0.011049	0.019051	0.078045	0.106477	0.923487	0.930228	0.500808	0.497959	0.832706	0.930228	6378	4615	{"mode":"lstm","model":"LSTM","n_features":75,"window":30,"horizon":30,"sub_window":5,"n_steps":6,"hidden_size":128,"n_layers":3,"dropout":0.2,"lr":0.001,"batch_size":32,"t1_percentile":20,"t2_percentile":85,"t1":0.2,"t2":0.8}	discarded	sub_window=5 (mse_within worse)
LSTM	0.010671	0.019349	0.076035	0.111208	0.931640	0.880390	0.505495	0.497872	0.809972	0.880607	6378	4615	{"mode":"lstm","model":"LSTM","n_features":75,"window":30,"horizon":30,"sub_window":10,"n_steps":3,"hidden_size":128,"n_layers":3,"dropout":0.2,"lr":0.001,"batch_size":32,"t1_percentile":20,"t2_percentile":85,"t1":0.25,"t2":0.7983}	kept	sub_window=10 (mse_within -2.1%)
LSTM	0.010763	0.018376	0.075369	0.106025	0.931034	0.883907	0.511218	0.502128	0.808934	0.883691	6380	4617	{"mode":"lstm","model":"LSTM","n_features":75,"window":20,"horizon":30,"sub_window":10,"n_steps":3,"hidden_size":128,"n_layers":3,"dropout":0.2,"lr":0.001,"batch_size":32,"t1_percentile":20,"t2_percentile":85,"t1":0.25,"t2":0.7983}	discarded	window=20 (mse_within worse)
LSTM	0.010372	0.018004	0.074093	0.105736	0.930488	0.882723	0.524800	0.495091	0.805900	0.882506	6373	4613	{"mode":"lstm","model":"LSTM","n_features":75,"window":40,"horizon":30,"sub_window":10,"n_steps":3,"hidden_size":128,"n_layers":3,"dropout":0.2,"lr":0.001,"batch_size":32,"t1_percentile":20,"t2_percentile":85,"t1":0.25,"t2":0.7982}	kept	window=40 (mse_within -2.8%, mse_cross -7.0%)
LSTM	0.011053	0.017813	0.077036	0.106378	0.931431	0.883761	0.507223	0.500000	0.808796	0.883761	6344	4594	{"mode":"lstm","model":"LSTM","n_features":75,"window":50,"horizon":30,"sub_window":10,"n_steps":3,"hidden_size":128,"n_layers":3,"dropout":0.2,"lr":0.001,"batch_size":32,"t1_percentile":20,"t2_percentile":85,"t1":0.25,"t2":0.7981}	discarded	window=50 (mse_within worse)
LSTM	0.011002	0.018222	0.078898	0.107257	0.906167	0.862562	0.517510	0.495858	0.783775	0.862562	6373	4613	{"mode":"lstm","model":"LSTM","n_features":75,"window":40,"horizon":30,"sub_window":15,"n_steps":2,"hidden_size":128,"n_layers":3,"dropout":0.2,"lr":0.001,"batch_size":32,"t1_percentile":20,"t2_percentile":85,"t1":0.2667,"t2":0.7667}	discarded	sub_window=15 (mse_within worse)
LSTM	0.010372	0.018004	0.074093	0.105736	0.930488	0.882723	0.524800	0.495091	0.805900	0.882506	6373	4613	{"mode":"lstm","model":"LSTM","n_features":75,"window":40,"horizon":30,"sub_window":10,"n_steps":3,"hidden_size":128,"n_layers":3,"dropout":0.2,"lr":0.001,"batch_size":32,"t1_percentile":20,"t2_percentile":85,"t1":0.25,"t2":0.7982}	kept	*** FINAL BEST combined config ***
LSTM	0.010452	0.018048	0.075534	0.105076	0.933424	0.877603	0.500795	0.485597	0.809048	0.883070	6609	4755	{"mode":"lstm","model":"LSTM","n_features":75,"window":40,"horizon":30,"sub_window":10,"n_steps":3,"hidden_size":128,"n_layers":3,"dropout":0.2,"lr":0.001,"batch_size":32,"t1_percentile":20,"t2_percentile":85,"t1":0.25,"t2":0.7987,"warmup_frames":0}	discarded	warmup=0 (mse_within worse)
LSTM	0.010831	0.019285	0.075886	0.108542	0.933724	0.880444	0.521127	0.508403	0.809803	0.880871	6488	4684	{"mode":"lstm","model":"LSTM","n_features":75,"window":40,"horizon":30,"sub_window":10,"n_steps":3,"hidden_size":128,"n_layers":3,"dropout":0.2,"lr":0.001,"batch_size":32,"t1_percentile":20,"t2_percentile":85,"t1":0.25,"t2":0.7984,"warmup_frames":100}	discarded	warmup=100 (mse_within worse)
LSTM	0.011249	0.018322	0.077697	0.107545	0.931440	0.879434	0.520325	0.497076	0.810970	0.879434	6126	4454	{"mode":"lstm","model":"LSTM","n_features":75,"window":40,"horizon":30,"sub_window":10,"n_steps":3,"hidden_size":128,"n_layers":3,"dropout":0.2,"lr":0.001,"batch_size":32,"t1_percentile":20,"t2_percentile":85,"t1":0.25,"t2":0.7988,"warmup_frames":400}	discarded	warmup=400 (mse_within worse)
LSTM	0.010582	0.020920	0.073679	0.110467	0.929860	0.853241	0.521600	0.471248	0.805900	0.882506	6373	4613	{"mode":"lstm","model":"LSTM","n_features":75,"window":40,"horizon":30,"sub_window":10,"n_steps":3,"hidden_size":128,"n_layers":3,"dropout":0.15,"lr":0.001,"batch_size":32,"t1_percentile":20,"t2_percentile":85,"t1":0.25,"t2":0.7982}	discarded	dropout=0.15 (mse_within worse, cross +16%)
LSTM	0.011314	0.018549	0.080354	0.108240	0.927820	0.882506	0.516800	0.495091	0.805900	0.882506	6373	4613	{"mode":"lstm","model":"LSTM","n_features":75,"window":40,"horizon":30,"sub_window":10,"n_steps":3,"hidden_size":128,"n_layers":3,"dropout":0.25,"lr":0.001,"batch_size":32,"t1_percentile":20,"t2_percentile":85,"t1":0.25,"t2":0.7982}	discarded	dropout=0.25 (mse_within worse)
LSTM	0.010846	0.019208	0.076699	0.108056	0.931900	0.882506	0.532800	0.495091	0.805900	0.882506	6373	4613	{"mode":"lstm","model":"LSTM","n_features":75,"window":40,"horizon":30,"sub_window":10,"n_steps":3,"hidden_size":128,"n_layers":3,"dropout":0.2,"lr":0.001,"batch_size":32,"t1_percentile":20,"t2_percentile":85,"t1":0.25,"t2":0.7983,"train_stride":5}	discarded	train_stride=5 (mse_within worse, 10x slower)
LSTM	0.010413	0.024334	0.074165	0.117590	0.929390	0.813787	0.516800	0.454418	0.805900	0.882506	6373	4613	{"mode":"lstm","model":"LSTM","n_features":40,"window":40,"horizon":30,"sub_window":10,"n_steps":3,"hidden_size":128,"n_layers":3,"dropout":0.2,"lr":0.001,"batch_size":32,"t1_percentile":20,"t2_percentile":85,"t1":0.25,"t2":0.7982}	discarded	Lasso-40 features (mse_cross +35%)
LSTM	0.010657	0.018864	0.074667	0.107390	0.930846	0.881296	0.441836	0.495845	0.808227	0.882238	19059	13799	{"mode":"lstm","model":"LSTM","n_features":75,"window":40,"horizon":30,"sub_window":10,"n_steps":3,"hidden_size":128,"n_layers":3,"dropout":0.2,"lr":0.001,"batch_size":32,"t1_percentile":20,"t2_percentile":85,"t1":0.25,"t2":0.7982,"eval_stride":10}	discarded	eval_stride=10 (cls_trans<0.50)
LSTM	0.010332	0.018440	0.072873	0.104075	0.931116	0.877737	0.520000	0.520337	0.805900	0.882506	6373	4613	{"mode":"lstm","model":"LSTM","n_features":75,"window":40,"horizon":30,"sub_window":10,"n_steps":3,"hidden_size":256,"n_layers":3,"dropout":0.2,"lr":0.001,"batch_size":32,"t1_percentile":20,"t2_percentile":85,"t1":0.25,"t2":0.7982}	kept	hidden=256 (mse_within -0.4%)
LSTM	0.010668	0.020493	0.074706	0.110209	0.930017	0.878604	0.521600	0.496494	0.805900	0.882506	6373	4613	{"mode":"lstm","model":"LSTM","n_features":75,"window":40,"horizon":30,"sub_window":10,"n_steps":3,"hidden_size":192,"n_layers":3,"dropout":0.2,"lr":0.001,"batch_size":32,"t1_percentile":20,"t2_percentile":85,"t1":0.25,"t2":0.7982}	discarded	hidden=192 (mse_within worse)
