model	mse_within	mse_cross	mae_within	mae_cross	cls_acc_within	cls_acc_cross	cls_trans_within	cls_trans_cross	majority_acc_within	majority_acc_cross	unc_sep_within	unc_sep_cross	cls_acc_cdf_within	cls_acc_cdf_cross	cls_trans_cdf_within	cls_trans_cdf_cross	n_within	n_cross	config	status	description
LSTM	0.013105	0.021140	0.086859	0.115363	0.958388	0.826750	0.543716	0.500629	0.805320	0.826750					6128	4456	{"mode": "lstm", "model": "LSTM", "n_features": 65, "window": 30, "horizon": 30, "sub_window": 6, "n_steps": 5, "hidden_size": 128, "n_layers": 4, "dropout": 0.4, "lr": 0.001, "batch_size": 64, "t1_percentile": 25, "t2_percentile": 90, "t1": 0.3194, "t2": 0.8611}	kept	[4CAM] PlainLSTM comparison at best S65 config: mse=0.01311
LSTM	0.008114	0.008114	0.071022	0.071022	0.628792	0.628792	0.504016	0.504016	0.574386	0.574386					2077	2077	{"mode": "lstm", "model": "LSTM", "n_features": 35, "window": 30, "horizon": 30, "sub_window": 6, "n_steps": 5, "hidden_size": 32, "n_layers": 4, "dropout": 0.3, "lr": 0.001, "batch_size": 64, "t1_percentile": 10, "t2_percentile": 70, "t1": 0.1389, "t2": 0.5667, "single_cam": "NE8th"}	kept	[1CAM] NE8th PlainLSTM comparison: mse=0.00811
LSTM	0.012027	0.012027	0.088464	0.088464	0.981514	0.981514	0.500000	0.500000	0.981514	0.981514					2272	2272	{"mode": "lstm", "model": "LSTM", "n_features": 65, "window": 30, "horizon": 30, "sub_window": 6, "n_steps": 5, "hidden_size": 64, "n_layers": 3, "dropout": 0.3, "lr": 0.001, "batch_size": 64, "t1_percentile": 10, "t2_percentile": 70, "t1": 0.3333, "t2": 0.8333, "single_cam": "Eastgate"}	kept	[1CAM] Eastgate PlainLSTM comparison: mse=0.01203
RF	0.015385	0.025550	0.096816	0.128557	0.947454	0.826750	0.527322	0.500629	0.805320	0.826750					6128	4456	{"mode": "rf", "model": "RF", "n_features": 65, "window": 30, "horizon": 30, "sub_window": 6, "n_steps": 5, "rf_n_estimators": 500, "rf_max_depth": 20, "rf_min_samples_leaf": 10, "t1_percentile": 25, "t2_percentile": 90, "t1": 0.3194, "t2": 0.8611}	kept	[4CAM] [RF] S65 warmup=400 t25/90: mse=0.01539
RF	0.007905	0.007905	0.069897	0.069897	0.617718	0.617718	0.536145	0.536145	0.574386	0.574386					2077	2077	{"mode": "rf", "model": "RF", "n_features": 35, "window": 30, "horizon": 30, "sub_window": 6, "n_steps": 5, "rf_n_estimators": 500, "rf_max_depth": 20, "rf_min_samples_leaf": 10, "t1_percentile": 10, "t2_percentile": 70, "t1": 0.1389, "t2": 0.5667, "single_cam": "NE8th"}	kept	[1CAM] [RF] NE8th TOP_35 warmup=300 t10/70: mse=0.00791
