commit	mse	mae	unc_sep	cls_acc	cls_trans	n_val	status	description
bc1375d	0.009120	0.069819	-0.001109	0.582996	0.460317	247	baseline	35feat h=64 2L λ1=0.1 λ2=0.01
0d184fd	0.009295	0.070975	-0.000311	0.550607	0.452381	247	discard	λ1=0.01
0d184fd	0.009475	0.071805	-0.000705	0.562753	0.444444	247	discard	λ1=0.05
0d184fd	0.009022	0.071167	-0.001770	0.546559	0.476190	247	discard	λ1=0.25
0d184fd	0.008895	0.071916	-0.000808	0.562753	0.468254	247	discard	λ1=0.5
0d184fd	0.008843	0.068705	-0.000614	0.587045	0.492063	247	keep	λ1=1.0 (best cls_acc+MSE)
0d184fd	0.009348	0.071170	-0.001008	0.566802	0.515873	247	discard	λ1=2.0
0d184fd	0.009231	0.070663	-0.000438	0.595142	0.563492	247	discard	λ1=5.0
0d184fd	0.008941	0.072774	-0.001106	0.530364	0.460317	247	discard	λ1=10.0
ba98d19	0.009436	0.072611	0.001652	0.607287	0.516949	247	keep	t1=20/t2=80 — first positive unc_sep!
0fec755	0.009441	0.070598	0.000740	0.587045	0.500000	247	discard	t1=25/t2=75
1744a7a	0.010177	0.073898	0.000583	0.574899	0.555556	247	discard	t1=20/t2=75
b1c84a6	0.010167	0.073574	0.000104	0.643725	0.525862	247	discard	t1=30/t2=80 (cls_acc high but unc_sep weak)
f28d9d9	0.009391	0.071834	-0.000575	0.542510	0.428571	247	discard	t1=33/t2=67
44733e5	0.008659	0.069890	0.000662	0.655870	0.525424	247	keep	t1=25/t2=80 (best cls_acc=0.656 + positive unc_sep)
4394ab9	0.008730	0.070644	0.000449	0.603239	0.458716	247	discard	t1=25/t2=85
cde34b0	0.009227	0.072336	0.000683	0.647773	0.532110	247	discard	t1=30/t2=85
3bb4699	0.008944	0.071877	-0.000382	0.603239	0.473214	247	discard	t1=40/t2=80
3ce98bc	0.009292	0.069821	0.000512	0.635628	0.542373	247	discard	h=128 2L
24eae4f	0.009327	0.071670	0.000365	0.611336	0.508475	247	discard	h=32 2L
06e6260	0.009117	0.072345	0.000267	0.591093	0.500000	247	discard	h=64 3L
1e437ac	0.009248	0.071389	0.001561	0.607287	0.550847	247	discard	h=64 1L (high unc_sep but lower cls_acc)
c868c03	0.009389	0.071545	0.001048	0.619433	0.525424	247	discard	dropout=0.3
4b43c9f	0.009289	0.072363	0.000451	0.582996	0.533898	247	discard	dropout=0.1
2774806	0.009424	0.074085	0.000229	0.599190	0.516949	247	discard	lr=5e-4
0902e16	0.008363	0.068875	0.001537	0.574899	0.457627	247	discard	lr=2e-3 (best MSE but low cls_acc)
4db390f	0.008976	0.070663	0.000639	0.611336	0.559322	247	discard	batch=32
c738585	0.008958	0.070502	0.001367	0.599190	0.525424	247	discard	batch=128
d966547	0.009278	0.071860	0.000271	0.607287	0.508475	247	discard	patience=60
69fa2d8	0.009102	0.069277	0.000650	0.643725	0.593220	247	discard	weight_decay=0
116a45f	0.009442	0.070036	0.001197	0.635628	0.576271	247	discard	grad_clip=0.5
26bf214	0.009081	0.069251	0.000823	0.647773	0.550847	247	discard	top-20 features
ec6f6a9	0.009491	0.075189	0.000300	0.550607	0.432203	247	discard	all 65 features
f66d306	0.008702	0.069665	0.000477	0.643725	0.508475	247	discard	top-25 features
e50e84a	0.011298	0.078402	0.001687	0.627530	0.517241	247	discard	horizon=20
ec47f9e	0.010104	0.075232	0.000472	0.651822	0.491803	247	discard	horizon=15
bb3374a	0.010657	0.075171	0.001520	0.647773	0.504854	247	keep	multi-step sub_window=6 (5 steps)
2a97e81	0.009671	0.074404	0.002787	0.599190	0.368932	247	discard	sub_window=5 (6 steps) — best unc_sep but low cls_acc
000505c	0.009189	0.072183	0.001788	0.599190	0.409091	247	discard	sub_window=10 (3 steps)
9cbfff3	0.010623	0.075206	0.001813	0.615385	0.504202	247	discard	sub_window=15 (2 steps)
93f7a87	0.008961	0.070478	-0.000285	0.635628	-	247	compare	plain_lstm MSE+MC-dropout
93f7a87	0.008930	0.072137	-0.000146	0.599190	-	247	compare	plain_gru MSE+MC-dropout
93f7a87	0.009387	0.072403	0.000493	0.611336	-	247	compare	random_forest tree-variance
93f7a87	0.009540	0.072966	0.000000	0.599190	-	247	compare	gradient_boosting staged-var
93f7a87	0.009288	0.072134	0.000000	0.623482	-	247	compare	xgboost staged-var
93f7a87	0.008850	0.070236	0.000046	0.599190	-	247	compare	lstm_rf_ensemble
910bdb3	0.009229	0.073307	0.001831	0.704453	0.572816	247	keep	λ1=0.5 multi-step sw=6 — BREAKTHROUGH cls_acc>0.70!
8c38452	0.010289	0.074521	0.000683	0.651822	0.485437	247	discard	λ1=0.25 multi-step
add7b50	0.009940	0.074948	0.001525	0.635628	0.436893	247	discard	λ1=0.75 multi-step
01e687f	0.009364	0.073302	0.001660	0.676113	0.553398	247	discard	λ2=0.1
8966fad	0.009506	0.073364	0.003000	0.639676	0.495146	247	discard	λ2=0.01 (record unc_sep but low cls_acc)
a5ad992	0.009464	0.073941	0.002228	0.736842	0.527473	247	keep	t1=20/t2=80 λ1=0.5 — NEW BEST cls_acc=0.737!
757406e	0.009829	0.073192	0.002902	0.785425	0.600000	247	keep	t1=15/t2=80 λ1=0.5 — NEW BEST cls_acc=0.785!
b9cf571	0.009741	0.072820	0.001280	0.829960	0.614286	247	keep	t1=10/t2=80 λ1=0.5 — NEW BEST cls_acc=0.830!
3636470	0.010659	0.076164	0.005935	0.842105	0.550000	247	keep	t1=10/t2=85 λ1=0.5 — NEW BEST cls_acc=0.842 unc_sep=0.006!
b68fbc4	0.009684	0.071853	0.001868	0.874494	0.541667	247	keep	t1=10/t2=90 λ1=0.5 — cls_acc=0.874 (check class balance)
e3dccf3	0.009899	0.074689	0.006019	0.850202	0.583333	247	keep	h=128 t1=10/t2=85 λ1=0.5 — cls_acc=0.850!
313691b	0.009409	0.072594	0.001387	0.846154	0.550000	247	discard	h=128 3L
2fe2b41	0.009561	0.072075	0.002358	0.854251	0.600000	247	keep	dropout=0.3 h=128 — NEW BEST cls_acc=0.854!
c1c77f3	0.010503	0.074696	0.002919	0.858300	0.600000	247	keep	dropout=0.4 h=128 — NEW BEST cls_acc=0.858!
b859d10	0.009498	0.071875	0.008945	0.846154	0.566667	247	discard	dropout=0.5 (record unc_sep but lower cls_acc)
1ddbcac	0.009464	0.071751	0.003716	0.846154	0.583333	247	discard	lr=5e-4
acc5920	0.008991	0.071444	0.003669	0.858300	0.650000	247	keep	λ1=0.3 h=128 drop=0.4 — tied cls_acc, better trans+unc_sep+MSE
ba70935	0.009944	0.073866	0.003632	0.850202	0.600000	247	discard	λ1=0.2
0e064c7	0.009761	0.072518	0.003942	0.858300	0.616667	247	discard	batch=32 (same cls_acc, lower trans)
b93d789	0.009401	0.072401	0.002226	0.854251	0.600000	247	discard	patience=60
bb2b787	0.009064	0.071218	0.002191	0.846154	0.550000	247	discard	λ2=0.025
60fa20e	0.009956	0.073542	0.001660	0.870445	0.576923	247	discard	t1=5/t2=85 (class imbalance inflated)
7dc4cfd	0.009566	0.072106	0.003910	0.850202	0.533333	247	discard	grad_clip=2.0
3a621ba	0.010925	0.076603	0.004706	0.842105	0.533333	247	discard	weight_decay=1e-4
7b2d0bf	0.010352	0.075090	0.005918	0.838057	0.533333	247	discard	h=256
16d384e	0.009814	0.072669	0.004846	0.842105	0.566667	247	discard	train_stride=5
9668169	0.009000	0.071028	0.002222	0.850202	0.600000	247	discard	wider head (128 intermediate)
611b379	0.009184	0.071490	0.002955	0.850202	0.600000	247	discard	λ1=0.35
de00e7a	0.009638	0.071748	0.006100	0.829960	0.533333	247	discard	window=20
1bace55	0.010152	0.073620	0.003741	0.829960	0.548387	247	discard	window=40
f51e0f5	0.008734	0.069564	0.002982	0.850202	0.600000	247	discard	GRU (best MSE but lower cls_acc)
181609e	0.010893	0.076679	0.001166	0.842105	0.500000	247	discard	2-layer head
1deb80e	0.009577	0.071072	0.003559	0.842105	0.566667	247	discard	scheduler patience=10
82e7278	-	-	-	0.847±0.012	-	247	stability	3-run mean: cls_acc=0.847±0.012 unc_sep=0.004±0.002
0fe3f8e	0.009794	0.073437	0.000870	0.858300	0.538462	247	discard	t2=87 (lower unc_sep+trans)
6aa4d94	0.010295	0.075206	0.003995	0.846154	0.533333	247	discard	λ1=0.4
bd8374c	0.009349	0.071128	0.003483	0.866397	0.633333	247	keep	CosineAnnealingLR — NEW BEST cls_acc=0.866!
1ced35a	-	-	-	0.854±0.009	-	247	stability	CosineAnnealing 3-run: cls_acc=0.854±0.009 unc_sep=0.003±0.0002
4e370d1	0.009412	0.071922	0.002611	0.850202	0.533333	247	discard	max_epochs=500
1068877	0.010151	0.074255	0.004983	0.850202	0.550000	247	discard	AdamW
bb82181	0.010211	0.074440	0.001211	0.854251	0.566667	247	discard	CosineWarmRestarts
777bfb1	0.009349	0.070096	0.007457	0.842105	0.550000	247	discard	lr=2e-3 cosine
a34a7d9	0.008863	0.069920	0.002600	0.850202	0.566667	247	discard	top-30 features
de23638	0.009482	0.073018	0.004161	0.846154	0.583333	247	discard	top-40 features
b17e45c	0.009932	0.075017	0.004256	0.847870	0.500000	493	discard	eval_stride=15 (more val samples)
cad32ed	0.009652	0.072457	0.005750	0.858300	0.616667	247	keep	LayerNorm in head — same cls_acc, much better unc_sep!
6fa596e	0.009863	0.074277	0.002612	0.854251	0.583333	247	discard	LayerNorm + λ2=0.1
8ea955a	0.009920	0.075411	0.000743	0.761134	-	247	compare_fair	plain_lstm (matched config)
8ea955a	0.008430	0.070208	-0.000118	0.765182	-	247	compare_fair	plain_gru (matched config)
8ea955a	0.009387	0.072403	0.000900	0.781377	-	247	compare_fair	random_forest (matched thresholds)
8ea955a	0.009540	0.072966	0.000000	0.793522	-	247	compare_fair	gradient_boosting (matched thresholds)
8ea955a	0.009288	0.072134	0.000000	0.793522	-	247	compare_fair	xgboost (matched thresholds)
8ea955a	0.009205	0.071599	0.000842	0.777328	-	247	compare_fair	lstm_rf_ensemble (matched config)
a3ba0ee	0.009310	0.072230	0.001199	0.785425	-	247	best_of	RF best: n=200 d=25 leaf=2
a3ba0ee	0.009411	0.072881	0.000000	0.793522	-	247	best_of	GB best: n=300 d=4 lr=0.05
a3ba0ee	0.009239	0.072310	0.000000	0.789474	-	247	best_of	XGB best: n=300 d=5 lr=0.03
